Title,Snippet,URL,Topics,Categories,Tags
Lịch sử của ẩm thực băng chuyền - Báo VnExpress Đời sống,"23 thg 4, 2012 ... Lẩu băng chuyền (Rotary Hot Pot) du nhập về Việt Nam như một sự kết hợp của quá trình tích hợp văn hóa, được phát triển vào năm 2009 - 2010 với ...",https://vnexpress.net/li-ch-su-cu-a-a-m-thu-c-bang-chuye-n-2307528.html,"thg Lẩu, băng chuyền Rotary Hot, một sự, văn hóa, Pot du nhập, phát triển vào năm, quá trình tích hợp",Chưa phân loại,"tích hợp văn, văn hóa, 2012, Rotary, Việt Nam, quá trình, 2009, 2010"
Sự ra đời của dây chuyền lắp ráp xe hơi - Báo VnExpress,"23 thg 9, 2004 ... Người ta vẫn coi Henry Ford là tác giả của dây chuyền lắp ráp xe ôtô, nhưng theo cộng sự thân tín của ông - Charles Sorensen - thì không phải ...",https://vnexpress.net/su-ra-doi-cua-day-chuyen-lap-rap-xe-hoi-1970298.html,"coi Henry Ford, xe ôtô nhưng, Charles Sorensen thì, thg Người ta vẫn, giả của dây chuyền, cộng sự thân tín",Chưa phân loại,"là tác, giả của dây chuyền, lắp ráp xe, theo cộng sự, cộng sự thân tín, 2004, Henry, Ford, dây chuyền, cộng sự"
Sushi băng chuyền dần biến mất ở Nhật Bản - Báo VnExpress Du lịch,"26 thg 9, 2024 ... Theo Sushi Chef Shiro, sushi băng chuyền hay kaitenzushi ra đời vào năm 1958 tại Nhật Bản, do Yoshiaki Shiraishi sáng tạo. Ông có ý tưởng này ...",https://vnexpress.net/sushi-bang-chuyen-dan-bien-mat-o-nhat-ban-4796917.html,"do Yoshiaki Shiraishi, thg Theo Sushi, băng chuyền hay kaitenzushi, sáng tạo Ông, năm tại Nhật Bản",Chưa phân loại,"26 thg, sushi băng chuyền, có ý tưởng, 2024, Sushi, Chef, Shiro, băng chuyền, Nhật Bản, Yoshiaki"
Joao Felix: 'Tôi không có bổn phận chuyền cho Ronaldo' - Báo ...,"10 thg 12, 2022 ... Đáp lại phát biểu của Fonte, Felix cho biết: ""Tôi không có bổn phần chuyền cho Ronaldo. Tôi luôn đưa ra những giải pháp tốt nhất cho đội bóng.",https://vnexpress.net/joao-felix-toi-khong-co-bon-phan-chuyen-cho-ronaldo-4546416.html,"thg Đáp lại, bổn phần chuyền, cho Ronaldo Tôi, tốt nhất, phát biểu của Fonte, luôn đưa ra",Chưa phân loại,"có bổn, bổn phần, giải pháp tốt, đội bóng, 2022, Fonte, Felix, phần, Ronaldo, giải pháp"
Cầu thủ Real bảo nhau không chuyền bóng cho Vinicius - Báo ...,"29 thg 10, 2020 ... Cầu thủ Real bảo nhau không chuyền bóng cho Vinicius. Karim Benzema bức bối khi chứng kiến màn trình diễn tồi tệ của đàn em Vinicius Jr, trong ...",https://vnexpress.net/cau-thu-real-bao-nhau-khong-chuyen-bong-cho-vinicius-4183719.html,"Real bảo nhau, cho Vinicius Karim, thg Cầu thủ, chứng kiến màn, Benzema bức bối, trình diễn tồi tệ",Thể thao,"bảo nhau, bức bối khi, chứng kiến màn, trình diễn tồi tệ, 2020, Cầu thủ, Real, nhau, Vinicius, Karim"
Bóng chuyền nữ Việt Nam dự World Cup 2025 - Báo VnExpress Thể ...,"31 thg 8, 2024 ... Bóng chuyền nữ Việt Nam dự World Cup 2025. Đội tuyển bóng chuyền nữ Việt Nam sẽ lần đầu tiên được tham dự World Cup sau khi Thái Lan giành quyền ...",https://vnexpress.net/bong-chuyen-nu-viet-nam-du-world-cup-2025-4787732.html,"dự World Cup, giành quyền, thg Bóng chuyền nữ, lần đầu tiên",Chưa phân loại,"31 thg, Bóng chuyền nữ, Đội tuyển bóng chuyền, bóng chuyền nữ, lần đầu tiên, sau khi, giành quyền, 2024, Việt Nam, World"
Toni Kroos lập kỷ lục chuyền bóng ở Euro - Báo VnExpress Thể thao,"15 thg 6, 2024 ... Toni Kroos lập kỷ lục chuyền bóng ở Euro. ĐứcTrong trận ra quân thắng Scotland 5-1, tiền vệ Đức Toni Kroos chuyền chính xác tới 99% - cao nhất ...",https://vnexpress.net/toni-kroos-lap-ky-luc-chuyen-bong-o-euro-4758526.html,"Toni Kroos lập, Euro ĐứcTrong trận, thắng Scotland, chuyền bóng ở, cao nhất, tiền vệ Đức, chính xác tới",Chưa phân loại,"lập kỷ lục, ĐứcTrong trận, trận ra quân, 2024, Toni, Kroos, kỷ lục, Euro, trận, ra quân"
Bóng chuyền nữ Việt Nam thua ngược CLB Hàn Quốc - Báo ...,"24 thg 7, 2024 ... Các cô gái Việt Nam thua CLB Red Sparks 1-3 ở giải giao hữu Thượng Hải Future Star tại Trung Quốc chiều 24/7. - VnExpress.",https://vnexpress.net/bong-chuyen-nu-viet-nam-thua-nguoc-clb-han-quoc-4773809.html,"thua CLB Red, Thượng Hải Future, Sparks ở giải, cô gái, chiều VnExpress, Star tại Trung Quốc",Chưa phân loại,"thua CLB, giải giao hữu, 2024, Việt Nam, Sparks, giải, giao hữu, Thượng, Future, Star"
Bóng chuyền nữ Việt Nam vô địch giải châu Á - Báo VnExpress Thể ...,"29 thg 5, 2024 ... Philippines- Tuyển bóng chuyền nữ Việt Nam bảo vệ thành công chức vô địch giải hạng hai châu Á AVC Challenge Cup 2024, khi thắng Kazakhstan ...",https://vnexpress.net/bong-chuyen-nu-viet-nam-vo-dich-giai-chau-a-4752078.html,"thg Philippines Tuyển, châu Á AVC Challenge, giải hạng hai, thắng Kazakhstan, bóng chuyền nữ, bảo vệ thành, công chức vô địch",Thể thao,"Tuyển bóng chuyền, bóng chuyền nữ, thành công chức, công chức vô địch, vô địch giải, giải hạng, 2024, Philippines, Tuyển, bóng chuyền"
Bóng chuyền nữ Việt Nam mất trụ cột ở SEA Games 32 - Báo ...,"28 thg 4, 2023 ... Thanh Nhã - từ cô bé khóc nhè thành trụ cột của tuyển Việt Nam · Từng úp mặt trên sân khóc nức nở vì sút hỏng lúc 16 tuổi, tiền vệ Nguyễn Thị ...",https://vnexpress.net/bong-chuyen-nu-viet-nam-mat-tru-cot-o-sea-games-32-4599308.html,"Từng úp mặt, sân khóc, Nguyễn Thị, vì sút hỏng, thg Thanh Nhã, tuyển Việt Nam, thành trụ cột, tuổi tiền vệ",Chưa phân loại,"thành trụ cột, úp mặt, 2023, Thanh Nhã, cô bé, trụ cột, tuyển, Việt Nam, tuổi, tiền vệ"
