Title,Snippet,URL,Topics
Nhà hát Lớn Hà Nội - Kiến trúc và lịch sử | VOV.VN,"Oct 26, 2009 ... Nhà hát Lớn là nơi đã chứng kiến những giây phút hoà bình đầu tiên trên đất nước, là một nhân chứng cách mạng của Thủ đô Hà Nội nghìn năm văn ...",https://vov.vn/ha-noi-ngan-nam/nha-hat-lon-ha-noi-kien-truc-va-lich-su-125222.vov,
Những điều chưa biết về Nhà hát Opera Sydney biểu tượng của ...,"Oct 20, 2018 ... Hành trình tới biểu tượng của Nhà hát Opera Sydney. VOV.VN-Kể từ khi bắt đầu mở cửa vào năm 1973, Nhà hát Opera đã trở thành biểu tượng của ...",https://vov.vn/the-gioi/cuoc-song-do-day/nhung-dieu-chua-biet-ve-nha-hat-opera-sydney-bieu-tuong-cua-australia-827973.vov,
Nhà hát Ca múa nhạc Quân đội - Những nghệ sỹ mặc áo lính hết ...,"May 18, 2024 ... Các nghệ sĩ, diễn viên của Nhà hát đã đi dọc chiều dài đất nước, từ núi rừng biên cương, đến các hải đảo xa xôi, cả những nơi khó khăn, ...",https://vov2.vov.vn/van-hoa-giai-tri/nhung-nghe-sy-mac-ao-linh-het-minh-vi-nghe-thuat-48405.vov2,
Nhà hát Trưng Vương – Thành phố Đà Nẵng | VOV3.VOV.VN,"Dec 21, 2023 ... Nhà hát Trưng Vương phấn đấu trở thành một đơn vị nghệ thuật đa năng, chuyên nghiệp ở tất cả mọi thể loại ca – múa – nhạc. Nhà hát Trưng Vương ...",https://vov3.vov.vn/am-nhac-viet-nam/nha-hat-trung-vuong-thanh-pho-da-nang-467.vov,
Thủ tướng Phạm Minh Chính dự lễ khánh thành Nhà hát “Đó”,"Apr 1, 2023 ... Trong thời gian làm việc tại Khánh Hòa , đoàn công tác của Chính phủ do Thủ tướng Phạm Minh Chính dẫn đầu đã đến dự khánh thành Nhà hát “Đó” ...",https://laodong.vn/thoi-su/thu-tuong-pham-minh-chinh-du-le-khanh-thanh-nha-hat-do-1174414.ldo,
Lí do hàng nghìn người tập trung trước Nhà hát lớn Hà Nội,"Nov 24, 2024 ... Người dùng mạng xã hội hiện đang chia sẻ hình ảnh hàng nghìn bạn trẻ tập trung trước khu vực Nhà hát lớn Hà Nội (Hoàn Kiếm, Hà Nội). Việc có quá ...",https://laodong.vn/ban-doc/li-do-hang-nghin-nguoi-tap-trung-truoc-nha-hat-lon-ha-noi-1425944.ldo,
Ai sẽ thay NSND Xuân Bắc làm Giám đốc Nhà hát Kịch Việt Nam?,"Oct 31, 2024 ... Ai sẽ thay NSND Xuân Bắc làm Giám đốc Nhà hát Kịch Việt Nam? ... NSND Xuân Bắc sẽ nhận nhiệm vụ mới là Cục trưởng Cục Nghệ thuật Biểu diễn từ ngày ...",https://laodong.vn/van-hoa-giai-tri/ai-se-thay-nsnd-xuan-bac-lam-giam-doc-nha-hat-kich-viet-nam-1415164.ldo,
Đại tướng Phan Văn Giang gửi thư mừng Nhà hát Chèo Quân đội,"Sep 30, 2024 ... Nhân kỷ niệm 70 năm Ngày truyền thống (1.10.1954 - 1.10.2024), Đại tướng Phan Văn Giang - Bộ trưởng Bộ Quốc phòng - gửi thư chúc mừng Nhà ...",https://laodong.vn/thoi-su/dai-tuong-phan-van-giang-gui-thu-mung-nha-hat-cheo-quan-doi-1401432.ldo,
"Ninh Bình có nhà hát mang tên ""Bà tổ ngành sân khấu""","Aug 2, 2024 ... Nhà văn hóa trung tâm tỉnh Ninh Bình chính thức được đổi tên thành Nhà hát Phạm Thị Trân - ""Bà tổ ngành sân khấu"" Việt Nam.",https://laodong.vn/van-hoa-giai-tri/ninh-binh-co-nha-hat-mang-ten-ba-to-nganh-san-khau-1374823.ldo,
Nhà hát Hồ Gươm trong top 10 nhà hát opera tuyệt vời nhất thế giới,"Dec 8, 2023 ... Nhà hát Hồ Gươm (Hà Nội) là đại diện duy nhất của Việt Nam lọt vào danh sách trên khi sánh vai cùng những “biểu tượng” của thế giới như: Nhà hát ...",https://laodong.vn/du-lich/tin-tuc/nha-hat-ho-guom-trong-top-10-nha-hat-opera-tuyet-voi-nhat-the-gioi-1277459.html,
NSND Tự Long được bổ nhiệm làm Giám đốc Nhà hát Chèo Quân đội,"Dec 30, 2024 ... Ngày 30.12, Hội nghị bàn giao chức trách, nhiệm vụ Giám đốc Nhà hát Chèo Quân đội do Thiếu tướng Trần Ngọc Anh, Phó Bí thư Đảng ủy Cơ quan TCCT, ...",https://laodong.vn/giai-tri/nsnd-tu-long-duoc-bo-nhiem-lam-giam-doc-nha-hat-cheo-quan-doi-1443162.ldo,
Hình tượng “Nhà hát Đó” ở Nha Trang gây tranh luận,"Feb 18, 2023 ... Trên một số phương tiện truyền thông giới thiệu nhà hát mới xây ở Nha Trang có tên “Đó” như một biểu tượng về du lịch, văn hóa mới của địa ...",https://laodong.vn/xa-hoi/hinh-tuong-nha-hat-do-o-nha-trang-gay-tranh-luan-1149040.ldo,
TPHCM sẽ xây Nhà hát Thủ Thiêm gần 2.000 tỉ đồng hiện đại bậc ...,"Jun 17, 2024 ... TPHCM - Nhà hát giao hưởng, nhạc và vũ kịch ở khu đô thị mới Thủ Thiêm (gọi tắt là Nhà hát Thủ Thiêm ) tổng vốn 2.000 tỉ đồng sẽ có thiết kế ...",https://laodong.vn/quy-hoach/tphcm-se-xay-nha-hat-thu-thiem-gan-2000-ti-dong-hien-dai-bac-nhat-the-gioi-1354245.ldo,
Lý do IS tấn công khủng bố nhà hát Nga,"Mar 24, 2024 ... Điều tra nguyên nhân người phụ nữ tử vong bất thường sau vụ đòi nợ ... Bình Thuận - Người phụ nữ 60 tuổi tử vong bất thường sau nhiều ngày điều ...",https://laodong.vn/tu-lieu/ly-do-is-tan-cong-khung-bo-nha-hat-nga-1318795.ldo,
Nhà hát VOH: Giấc mơ của những người làm nghề | BÁO SÀI GÒN ...,"Jun 29, 2017 ... Nhà hát có 350 ghế này được cải tạo từ hội trường của Đài Tiếng nói Nhân dân TPHCM với trang bị mới hoàn toàn từ hệ thống âm thanh, ánh sáng, ...",https://www.sggp.org.vn/nha-hat-voh-giac-mo-cua-nhung-nguoi-lam-nghe-post439555.html,
Quảng Bình: Nhà hát hơn 216 tỷ đồng nứt tứ phía | BÁO SÀI GÒN ...,"Sep 26, 2019 ... Ngày 26-9, người dân lại phát hiện nhà hát Quảng Bình thuộc Trung tâm văn hóa tỉnh Quảng Bình (phường Đồng Phú, thành phố Đồng Hới) vừa đưa ...",https://www.sggp.org.vn/quang-binh-nha-hat-hon-216-ty-dong-nut-tu-phia-post532217.html,
Khai trương Nhà hát Quân đội tại TP Hồ Chí Minh | BÁO SÀI GÒN ...,"Apr 10, 2009 ... Đây là một nhà hát hiện đại do Bộ Quốc phòng đầu tư xây dựng với kinh phí 50 tỷ đồng (chưa kể trang thiết bị chuyên ngành), khuôn viên rộng gần ...",https://www.sggp.org.vn/khai-truong-nha-hat-quan-doi-tai-tp-ho-chi-minh-post74174.html,
Bình Thuận: Dự án nhà hát 200 tỷ đồng lại chậm tiến độ | BÁO SÀI ...,"Nov 20, 2024 ... Bình Thuận: Dự án nhà hát 200 tỷ đồng lại chậm tiến độ ... UBND tỉnh Bình Thuận yêu cầu rà soát lại toàn bộ hồ sơ dự án Nhà hát và triển lãm văn ...",https://www.sggp.org.vn/binh-thuan-du-an-nha-hat-200-ty-dong-lai-cham-tien-do-post769249.html,
Những nhà hát nổi tiếng thế giới - Bài 1: Đến với hai biểu tượng của ...,"Oct 29, 2018 ... Khán phòng gồm 5 tầng, có sức chứa hơn 2.200 khán giả, nổi bật với sắc đỏ và vàng. Mái vòm của khán phòng lớn được trang trí bằng bức bích họa ...",https://www.sggp.org.vn/nhung-nha-hat-noi-tieng-the-gioi-bai-1-den-voi-hai-bieu-tuong-cua-phap-va-nga-post497856.html,
Nhà hát Nghệ thuật Hát bội đối mặt thách thức | BÁO SÀI GÒN GIẢI ...,"Jul 26, 2020 ... 5 năm qua, gần 10 nghệ sĩ kỳ cựu, giỏi nghề của Nhà hát Nghệ thuật Hát bội TPHCM rời sàn diễn vì đến tuổi hưu, trong khi lớp trẻ bổ sung vào ...",https://www.sggp.org.vn/nha-hat-nghe-thuat-hat-boi-doi-mat-thach-thuc-post562946.html,
Đã có “ngôi nhà riêng” cho sân khấu truyền thống tại Hà Nội | BÁO ...,"Aug 19, 2007 ... Nhà hát Kim Mã, nơi đang diễn ra những hoạt động kỷ niệm 50 năm Hội Nghệ sĩ sân khấu Việt Nam. Sau 7 năm trời lận đận, đến nay, nhà ...",https://www.sggp.org.vn/da-co-ngoi-nha-rieng-cho-san-khau-truyen-thong-tai-ha-noi-post34865.html,
"Nhà hát Ca múa nhạc Dân tộc Bông Sen giữ gìn, phát huy nghệ ...","Sep 13, 2011 ... Nhà hát Ca múa nhạc Dân tộc Bông Sen giữ gìn, phát huy nghệ thuật dân tộc ... Trong những ngày này, Nhà hát Ca múa nhạc dân tộc Bông Sen rộn ràng ...",https://www.sggp.org.vn/nha-hat-ca-mua-nhac-dan-toc-bong-sen-giu-gin-phat-huy-nghe-thuat-dan-toc-post104215.html,
Khởi công công trình sửa chữa lớn Nhà hát Hòa Bình | BÁO SÀI ...,"Dec 21, 2024 ... Sáng 22-12, UBND quận 10 tổ chức lễ khởi công công trình sửa chữa lớn Nhà hát Hòa Bình nhân kỷ niệm 50 năm Ngày Giải phóng miền Nam, ...",https://www.sggp.org.vn/khoi-cong-cong-trinh-sua-chua-lon-nha-hat-hoa-binh-post774303.html,
Bao giờ khôi phục Nhà hát An Nhơn Tây? | BÁO SÀI GÒN GIẢI ...,"Jun 8, 2006 ... Bao giờ khôi phục Nhà hát An Nhơn Tây? ... Bao giờ khôi phục Nhà hát An Nhơn Tây? Trên mặt bằng 12.000m2 tọa lạc tại ngã tư Tỉnh lộ 15 và Tỉnh lộ ...",https://www.sggp.org.vn/bao-gio-khoi-phuc-nha-hat-an-nhon-tay-post246766.html,
Thủ tướng Phạm Minh Chính cắt băng khánh thành Nhà hát Đó ở ...,"Apr 1, 2023 ... (PLO)- Thủ tướng Phạm Minh Chính đã dự lễ và cắt băng khánh thành Nhà hát Đó – được lấy cảm hứng từ chiếc đó, nông cụ bắt cá của người dân.",https://plo.vn/thu-tuong-pham-minh-chinh-cat-bang-khanh-thanh-nha-hat-do-o-khanh-hoa-post726742.html,
Bộ Công an khánh thành Nhà hát Hồ Gươm | Báo Pháp Luật TP. Hồ ...,"Jul 9, 2023 ... (PLO)- Công trình Nhà hát Hồ Gươm xây dựng trên khu đất 40 Hàng Bài, Hà Nội, do Bộ Công an quản lý, nay được cắt băng khánh thành.",https://plo.vn/bo-cong-an-khanh-thanh-nha-hat-ho-guom-post741472.html,
NSƯT Chí Trung thôi giữ chức Giám đốc Nhà hát Tuổi trẻ | Báo ...,"May 26, 2022 ... (PLO)- NSƯT Sĩ Tiến đảm nhận vị trí Giám đốc Nhà hát Tuổi trẻ từ ngày 1-6 thay cho NSƯT Chí Trung đến tuổi hưu.",https://plo.vn/nsut-chi-trung-thoi-giu-chuc-giam-doc-nha-hat-tuoi-tre-post681909.html,
Nhà hát 200 tỉ đồng lợp tôn làm 'nóng' kỳ họp HĐND tỉnh Bình Thuận,"Jul 11, 2023 ... Nhà hát 200 tỉ đồng lợp tôn làm 'nóng' kỳ họp HĐND tỉnh Bình Thuận ... (PLO)- Công trình sử dụng thiết kế cũ từ năm 2007 nhưng vẫn được duyệt, dẫn ...",https://plo.vn/nha-hat-200-ti-dong-lop-ton-lam-nong-ky-hop-hdnd-tinh-binh-thuan-post741803.html,
Bình Thuận cho kéo dài dự án Nhà hát 200 tỷ đồng hết năm 2025 ...,"Jul 18, 2024 ... Theo báo cáo thẩm tra của ban Kinh tế - Ngân sách, HĐND tỉnh, dự án Nhà hát được chấp thuận chủ trương đầu tư từ năm 2015 với tổng mức đầu tư là ...",https://plo.vn/binh-thuan-cho-keo-dai-thuc-hien-du-an-nha-hat-200-ti-dong-het-nam-2025-post801163.html,
Vân Sơn mở nhà hát tại TP.HCM | Báo Pháp Luật TP. Hồ Chí Minh,"Dec 21, 2015 ... (PLO) - Sau thời gian về TP.HCM thực hiện các chương trình của mình, chiều 21-12 nghệ sĩ hải ngoại Vân Sơn đã chính thức ra mắt Nhà hát The ...",https://plo.vn/van-son-mo-nha-hat-tai-tphcm-post371947.html,
Đà Nẵng: Cháy tầng hầm Nhà hát Trưng Vương | Báo Pháp Luật TP ...,"Oct 10, 2024 ... Đà Nẵng: Cháy tầng hầm Nhà hát Trưng Vương ... (PLO)- Nhận tin báo, lực lượng chữa cháy nhanh chóng đến Nhà hát Trưng Vương để xử lý. ... Trưa ngày ...",https://plo.vn/da-nang-chay-tang-ham-nha-hat-trung-vuong-post814408.html,
"Cháy Nhà hát Kịch TP.HCM, rạp Công Nhân vẫn niêm phong | Báo ...","Oct 4, 2019 ... Cháy Nhà hát Kịch TP.HCM, rạp Công Nhân vẫn niêm phong ... Khoảng 5 giờ ngày 2-10, rạp Công Nhân (đường Trần Hưng Đạo, quận 1, TP.HCM) cũng là trụ ...",https://plo.vn/chay-nha-hat-kich-tphcm-rap-cong-nhan-van-niem-phong-post543927.html,
Bình Thuận: Đưa dự án nhà hát 200 tỷ ra khỏi công trình đầu tư ...,"Oct 12, 2023 ... Bình Thuận: Đưa dự án nhà hát 200 tỷ ra khỏi công trình đầu tư trọng điểm · Nhà hát 200 tỉ đồng lợp tôn làm 'nóng' kỳ họp HĐND tỉnh Bình Thuận.",https://plo.vn/binh-thuan-dua-du-an-nha-hat-200-ty-ra-khoi-cong-trinh-dau-tu-trong-diem-post756239.html,
Netflix mua lại nhà hát Ai Cập lịch sử của Hollywood | Báo Pháp ...,"Jun 1, 2020 ... (PLO)- Phía Netflix có thông báo đã chính thức mua lại Nhà hát Ai Cập, Grauman trên đại lộ Hollywood.",https://plo.vn/netflix-mua-lai-nha-hat-ai-cap-lich-su-cua-hollywood-post577917.html,
Độc đáo Nhà hát “ba nón lá” ở Bạc Liêu,"Apr 16, 2023 ... Nhà hát “ba nón lá” đã được tổ chức Kỷ lục Việt Nam (VietKings) xác lập kỷ lục “Nhà hát Cao Văn Lầu có hình dạng ba chiếc nón lá lớn nhất ...",https://nhandan.vn/doc-dao-nha-hat-ba-non-la-o-bac-lieu-post748068.html,
Cận cảnh kiến trúc đẹp ấn tượng của nhà hát Hồ Gươm,"Jul 11, 2023 ... Nhà hát Hồ Gươm với trang thiết bị hiện đại nhất nước, do Bộ Công an và UBND thành phố Hà Nội xây dựng, khánh thành sáng 9/7, ...",https://nhandan.vn/anh-chiem-nguong-kien-truc-an-tuong-cua-nha-hat-ho-guom-nha-hat-hien-dai-nhat-viet-nam-post761692.html,
Đặc sắc nhà hát mới ở trong làng cổ,"Jun 16, 2023 ... Hội kiến trúc sư Việt Nam đã trao tặng giải Bạc - giải thưởng kiến trúc quốc gia năm 2022-2023, cho công trình Nhà hát Dân ca Quan họ Bắc ...",https://nhandan.vn/dac-sac-nha-hat-moi-o-trong-lang-co-post757933.html,
NSND Công Lý được bổ nhiệm làm Phó Giám đốc Nhà hát Kịch Hà ...,"May 7, 2020 ... NDĐT – Ngày 7-5, NSND Công Lý đã chính thức nhận quyết định bổ nhiệm giữ chức vụ Phó Giám đốc Nhà hát Kịch Hà Nội. Thứ năm, ngày 07/05/2020 - 15 ...",https://nhandan.vn/nsnd-cong-ly-duoc-bo-nhiem-lam-pho-giam-doc-nha-hat-kich-ha-noi-post457556.html,
Nhà hát Lớn Hà Nội ra mắt không gian Vườn âm nhạc,"Mar 3, 2024 ... Với sự kết hợp đầy lãng mạn giữa khung cảnh thiên nhiên cùng ánh sáng và âm nhạc, không gian ngoài trời của Nhà hát Lớn Hà Nội đã trở thành ...",https://nhandan.vn/nha-hat-lon-ha-noi-ra-mat-khong-gian-vuon-am-nhac-post798406.html,
Khánh thành Nhà hát “Đó” tại Vega City Nha Trang,"Apr 1, 2023 ... Khánh thành Nhà hát “Đó” tại Vega City Nha Trang. NDO - Ngày 1/4, tại Nha Trang, tập đoàn KDI Holdings, chủ đầu tư quần thể phức hợp nghỉ dưỡng- ...",https://nhandan.vn/khanh-thanh-nha-hat-do-tai-vega-city-nha-trang-post745834.html,
Nhớ một thời Nhà hát nhân dân,"Nov 2, 2017 ... Khi có Nhà hát nhân dân trên nền xưa của nhà Đấu Xảo Hà Nội, thì tôi là một cô bé quàng khăn đỏ. Tôi nhớ mãi về nhà hát mà tôi đã từng vào ...",https://nhandan.vn/nho-mot-thoi-nha-hat-nhan-dan-post308233.html,
Nhà hát Ca múa nhạc Thăng Long kỷ niệm 60 năm thành lập và đón ...,"Oct 22, 2020 ... Nhà hát Ca múa nhạc Thăng Long nhận Huân chương Lao động hạng Ba. Đến dự có đồng chí Lương Thanh Nghị, Phó Chủ nhiệm Ủy ban Nhà nước về người ...",https://nhandan.vn/nha-hat-ca-mua-nhac-thang-long-ky-niem-60-nam-thanh-lap-va-don-nhan-huan-chuong-lao-dong-hang-ba-post621430.html,
Để Nhà hát Lớn Hà Nội luôn sáng đèn vì nghệ thuật,"Jul 30, 2016 ... Giám đốc Nhà hát Múa rối Việt Nam Ngô Thanh Thủy bày tỏ lo lắng: “Là đơn vị còn được bao cấp mà vấn đề bảo tồn NTTT hết sức khó khăn. Chúng tôi ...",https://nhandan.vn/de-nha-hat-lon-ha-noi-luon-sang-den-vi-nghe-thuat-post268657.html,
Vụ giải cứu con tin nghẹt thở tại Moscow,"Nov 15, 2022 ... Hơn hai thập kỷ trước, ngày 23/10/2002, nhóm khủng bố người Chechnya do đối tượng Movsar Baraev (23 tuổi) cầm đầu xông vào nhà hát ở ...",https://nhandan.vn/vu-giai-cuu-con-tin-nghet-tho-tai-moscow-post724925.html,
"Khánh thành Nhà hát Đó - điểm nhấn mới của văn hóa, du lịch ...","Apr 1, 2023 ... (Chinhphu.vn) - Sáng 1/4, trong chương trình công tác tại tỉnh Khánh Hòa, Thủ tướng Phạm Minh Chính đã dự lễ khánh thành Nhà hát Đó - một ...",https://baochinhphu.vn/khanh-thanh-nha-hat-do-diem-nhan-moi-cua-van-hoa-du-lich-khanh-hoa-102230401122125517.htm,
Nhà hát Hồ Gươm-Tuyệt tác nghệ thuật giữa lòng Thủ đô,"Oct 7, 2024 ... Hà Nội đầu tư xây dựng, Nhà hát Hồ Gươm tọa lạc tại vị trí đắc địa giàu giá trị văn hóa bậc nhất của Thủ đô, chỉ cách Hồ Gươm vài trăm mét. Đồng ...",https://baochinhphu.vn/nha-hat-ho-guom-tuyet-tac-nghe-thuat-giua-long-thu-do-102241007181820611.htm,
100 năm Nhà hát lớn Hà Nội và các sự kiện lịch sử,"Dec 8, 2011 ... Trong hai năm 1996 - 1997, với sự giúp đỡ của Chính phủ nước Cộng hòa Pháp (156 tỉ đồng VN), Nhà hát lớn Hà Nội đã được tu bổ, tôn tạo và nâng ...",https://baochinhphu.vn/100-nam-nha-hat-lon-ha-noi-va-cac-su-kien-lich-su-102111838.htm,
Nhà hát Lớn Hà Nội trở thành Di tích Lịch sử - Kiến trúc quốc gia,"Dec 9, 2011 ... (Chinhphu.vn) - Sáng ngày 9/12, Nhà hát Lớn Hà Nội đã tổ chức Lễ kỷ niệm 100 năm thành lập và đón Bằng xếp hạng Di tích quốc gia. ... Nhà hát Lớn ...",https://baochinhphu.vn/nha-hat-lon-ha-noi-tro-thanh-di-tich-lich-su-kien-truc-quoc-gia-10296651.htm,
Nhà hát Lớn Hà Nội đóng cửa 1 năm để tu bổ,"Apr 4, 2023 ... (Chinhphu.vn) - Bà Nguyễn Thị Minh Nguyệt, Giám đốc Nhà hát Lớn Hà Nội cho biết, dự kiến nhà hát sẽ đóng cửa trong 1 năm để tiến hành tu bổ. Nhà ...",https://thanglong.baochinhphu.vn/nha-hat-lon-ha-noi-dong-cua-1-nam-de-tu-bo-103230404123930958.htm,
Hà Nội duyệt quy hoạch nhà hát Opera hiện đại tại bán đảo Quảng An,"Nov 28, 2024 ... Phối cảnh nhà hát bên Hồ Tây, Hà Nội. UBND thành phố Hà Nội vừa phê duyệt đồ án Quy hoạch chi tiết khu vực trục không gian trung tâm bán đảo ...",https://thanglong.baochinhphu.vn/ha-noi-duyet-quy-hoach-nha-hat-opera-hien-dai-tai-ban-dao-quang-an-103241128160148772.htm,
Nhà hát Múa rối Thăng Long kỷ niệm 55 năm thành lập,"Dec 25, 2024 ... (Chinhphu.vn) - Ngày 25/12, tại Hà Nội, Nhà hát Múa rối Thăng Long trang trọng tổ chức kỷ niệm 55 năm thành lập (10/10/1969 - 10/10/2024) và ...",https://thanglong.baochinhphu.vn/nha-hat-mua-roi-thang-long-ky-niem-55-nam-thanh-lap-103241225170015914.htm,
Nhà hát Múa rối Thăng Long đoạt giải Nhất biểu diễn tuyên truyền ...,"Jan 7, 2022 ... (Chinhphu.vn) - Chiều 7/1, Cục Nghệ thuật biểu diễn (Bộ Văn hóa, Thể thao và Du lịch) tổng kết và trao giải Bình chọn các sản phẩm bản ghi ...",https://thanglong.baochinhphu.vn/nha-hat-mua-roi-thang-long-doat-giai-nhat-bieu-dien-tuyen-truyen-chong-dich-covid-19-103220115151527079.htm,
Bắt khẩn cấp tài xế gây rối trật tự công cộng trước Nhà hát lớn Hà Nội,"Apr 18, 2023 ... (Chinhphu.vn) - Công an quận Hoàn Kiếm (Hà Nội) đã ra quyết định bắt khẩn cấp Nguyễn Ngọc Thắng, tài xế ô tô ""drift"" trước Nhà hát Lớn Hà Nội để ...",https://baochinhphu.vn/bat-khan-cap-tai-xe-gay-roi-trat-tu-cong-cong-truoc-nha-hat-lon-ha-noi-102230418203421175.htm,
Nhà hát lớn Hà Nội sẽ chỉ dành cho biểu diễn nghệ thuật đỉnh cao,"Jul 9, 2016 ... (Chinhphu.vn) - “Đất nước nào cũng phải có nghệ thuật đỉnh cao để đại diện nền văn hoá của dân tộc quảng bá giao lưu thế giới.",https://thanglong.baochinhphu.vn/nha-hat-lon-ha-noi-se-chi-danh-cho-bieu-dien-nghe-thuat-dinh-cao-10317082.htm,
Nhà hát những giấc mơ - 27/02/2021 - Video đã phát trên VTV3 ...,"Feb 27, 2021 ... Video clip Nhà hát những giấc mơ - 27/02/2021 của đài truyền hình Việt Nam. Xem Nhà hát những giấc mơ - 27/02/2021 chất lượng cao và nhanh ...",https://vtv.vn/video/nha-hat-nhung-giac-mo-27-02-2021-487766.htm,
Nhà hát Opera Sydney - công trình kiến trúc vượt mọi thời đại | VTV ...,"Nov 11, 2023 ... Australia chi 153 triệu USD để trùng tu nhà hát Opera Sydney. Nhà hát Opera Sydney, hay nhà hát con sò - niềm tự hào lớn của xứ sở chuột túi và ...",https://vtv.vn/the-gioi/nha-hat-opera-sydney-cong-trinh-kien-truc-vuot-moi-thoi-dai-20231110224417318.htm,
Chương trình biểu diễn ở nhà hát lớn,"VTV.vn - Nhằm phục vụ công chúng yêu nghệ thuật, loạt chương trình biểu diễn nghệ thuật đặc sắc sẽ được diễn ra tại Nhà hát Lớn Hà Nội từ cuối tháng 8/2016.",https://vtv.vn/chuong-trinh-bieu-dien-o-nha-hat-lon.html,
Nhà hát lớn Moscow - Thánh đường nghệ thuật của xứ sở bạch ...,"Jul 25, 2016 ... Hơn 2 thế kỷ qua, Nhà hát lớn ở thủ đô Moscow, Liên bang Nga xứng danh là thánh đường nghệ thuật. Bên cạnh bề dày lịch sử hơn 200 năm và vẻ đẹp ...",https://vtv.vn/du-lich/nha-hat-lon-moscow-thanh-duong-nghe-thuat-cua-xu-so-bach-duong-20160723164313022.htm,
60 năm vàng son của Nhà hát kịch Hà Nội | VTV.VN,"Dec 27, 2019 ... Vở kịch ""Đôi mắt"" thắng lớn tại Hàn Quốc. VTV.vn - Vở kịch lấy bối cảnh một trạm quân y dã chiến ở núi rừng Trường Sơn, những người lính bị ...",https://vtv.vn/doi-song/60-nam-vang-son-cua-nha-hat-kich-ha-noi-20191227183230828.htm,
Cháy quán bar ở tầng hầm Nhà hát Trưng Vương (Đà Nẵng) | VTV.VN,"Oct 11, 2024 ... Cháy quán bar ở tầng hầm Nhà hát Trưng Vương (Đà Nẵng) ... VTV.vn - Sáng ngày 11/10, lực lượng chức năng TP Đà Nẵng phải dùng xe hút khỏi để xử lý ...",https://vtv.vn/xa-hoi/chay-quan-bar-o-tang-ham-nha-hat-trung-vuong-da-nang-20241011123744675.htm,
4 nhà hát vòng tròn cổ kính nhất thế giới | VTV.VN,"Feb 27, 2015 ... (VTV.vn) - Verona Arena, Pula Arena, Arles Amphitheatre và Arena Nîmes là 4 nhà hát vòng tròn cổ kính nhất thế giới, vẫn còn nguyên giá trị ...",https://vtv.vn/du-lich/4-nha-hat-vong-tron-co-kinh-nhat-the-gioi-20150228024310656.htm,
Nga kết luận về nhóm khủng bố quốc tế tham gia vụ tấn công nhà ...,"Jul 17, 2024 ... Ông Yury Chikhanchin cho biết vụ tấn công khủng bố đẫm máu tại nhà hát Crocus City Hall ở ngoại ô Moskva hồi tháng 3 vừa qua do một nhóm đối ...",https://vtv.vn/the-gioi/nga-ket-luan-ve-nhom-khung-bo-quoc-te-tham-gia-vu-tan-cong-nha-hat-crocus-20240716230502448.htm,
"Khánh thành Nhà hát Đó - điểm nhấn mới của văn hóa, du lịch ...","Apr 1, 2023 ... Khánh thành Nhà hát Đó - điểm nhấn mới của văn hóa, du lịch Khánh Hòa ... VTV.vn - Sáng 1/4, trong chương trình công tác tại tỉnh Khánh Hòa, Thủ ...",https://vtv.vn/chinh-tri/khanh-thanh-nha-hat-do-diem-nhan-moi-cua-van-hoa-du-lich-khanh-hoa-20230401160829123.htm,
NSND Tự Long được bổ nhiệm làm Giám đốc Nhà hát Chèo Quân ...,"Dec 31, 2024 ... VTV.vn - Chiều 30/12, NSND Tự Long đã nhận quyết định bổ nhiệm làm Giám đốc Nhà hát Chèo Quân đội.",https://vtv.vn/van-hoa-giai-tri/nsnd-tu-long-duoc-bo-nhiem-lam-giam-doc-nha-hat-cheo-quan-doi-20241230233416983.htm,
Vi phạm tại dự án xây dựng Nhà hát tỉnh An Giang - Nhịp sống kinh ...,"Mar 5, 2024 ... LOẠT VI PHẠM TRONG ĐẦU TƯ XÂY DỰNG. Theo kết luận, tổng mức đầu tư dự án nhà hát tỉnh An Giang hơn 215 tỷ đồng. Nguồn vốn từ ngân sách địa ...",https://vneconomy.vn/vi-pham-tai-du-an-xay-dung-nha-hat-tinh-an-giang.htm,
Thu 400.000 đồng một lượt tham quan Nhà hát lớn Hà Nội - Nhịp ...,"Sep 7, 2017 ... Nhà hát Lớn Hà Nội được người Pháp xây dụng và hoàn thảnh ở năm 1911, là một biểu tượng văn hóa, lịch sử và kiến trúc của Hà Nội cho tới ngày ...",https://vneconomy.vn/thu-400000-dong-mot-luot-tham-quan-nha-hat-lon-ha-noi.htm,
TP.HCM tạm dừng xây dựng nhà hát “nghìn tỷ” ở Thủ Thiêm - Nhịp ...,"Aug 25, 2022 ... Dự án rộng 1,2 ha, tổng vốn đầu khoảng 2.200 tỷ đồng, gồm hai khán phòng chính có sức chứa 1.700 chỗ (khán phòng lớn 1.200 chỗ và khán phòng nhỏ ...",https://vneconomy.vn/tp-hcm-tam-dung-xay-dung-nha-hat-nghin-ty-o-thu-thiem.htm,
Hà Nội sẽ có nhà hát Opera trên hồ Đầm Trị? - Nhịp sống kinh tế ...,"Jul 20, 2022 ... UBND quận Tây Hồ, Hà Nội vừa tổ chức hội nghị lấy ý kiến người dân đối với đồ án Quy hoạch chi tiết 1/500 khu vực trục không gian trung tâm bán ...",https://vneconomy.vn/ha-noi-se-co-nha-hat-opera-tren-ho-dam-tri.htm,
