Title,Snippet,URL,Topics
Vaquarius tổ chức chương trình roadshow đầu tiên từ Nhà hát Lớn ...,"Apr 1, 2024 ... Vaquarius sẽ là một trung tâm hành chính, kinh tế, văn hoá, lễ hội của thành phố Văn Giang tương lai. Đây cũng là vùng đất sở hữu phong thủy đắc ...",https://vneconomy.vn/vaquarius-to-chuc-chuong-trinh-roadshow-dau-tien-tu-nha-hat-lon-ha-noi-den-hung-yen.htm,
BST Haute Couture Xuân Hè của Elie Saab: nhà hát của giấc mơ ...,"Feb 22, 2021 ... Mỗi bộ trang phục đều có các chi tiết kết thành từng mảng tạo điểm nhấn, từ cầu vai tạo phồng, cho đến họa tiết tạo nên bởi hạt cườm và lông vũ.",https://vneconomy.vn/bst-haute-couture-xuan-he-cua-elie-saab-nha-hat-cua-giac-mo.htm,
TP.HCM: Dự án metro số 1 hoàn thành 100% ba nhà ga đầu tiên ...,"Dec 6, 2022 ... Hai nhà ga ngầm là ga Nhà hát Thành phố và ga Ba Son, cùng một ga trên cao là nhà ga Khu công nghệ cao, là ba trong tổng số 14 ga của dự án ...",https://vneconomy.vn/tp-hcm-du-an-metro-so-1-hoan-thanh-100-ba-nha-ga-dau-tien.htm,
[Trực tiếp]: Lễ hội Hoa Phượng Đỏ Hải Phòng 2024 - Bừng sáng ...,"May 11, 2024 ... ... nhà hát thành phố; Lễ hội áo dài năm 2024 với chủ đề ""Về miền di sản cửa biển"" ... Các hoạt động trên được xem là những hiệu ứng quan trọng ...",https://vneconomy.vn/truc-tiep-le-hoi-hoa-phuong-do-hai-phong-2024-bung-sang-mien-di-san.htm,
Thảm sát tại Paris đã diễn ra như thế nào? - Nhịp sống kinh tế Việt ...,"Nov 14, 2015 ... Nhà hát Bataclan, nơi những kẻ khủng bố cướp đi mạng sống của hơn ... nhà hàng xung quanh Bataclan trước khi tấn công vào nhà hát. Một ...",https://vneconomy.vn/tham-sat-tai-paris-da-dien-ra-nhu-the-nao.htm,
Trực tiếp Lễ trao giải Khoa học - Công nghệ VinFuture 2024 - Nhịp ...,"Dec 6, 2024 ... ... Nhà hát Hồ Gươm. Tối nay (6/12), Lễ trao giải Khoa học - Công nghệ toàn cầu VinFuture 2024 sẽ chính thức diễn ra tại Nhà hát Hồ Gươm (Hà Nội).",https://vneconomy.vn/techconnect/truc-tiep-le-trao-giai-khoa-hoc-cong-nghe-vinfuture-2024.htm,
"Bỏ ra 400 tỷ đồng xây nhà hát hình chiếc Đó, KDI Holdings đang thu ...","Apr 16, 2023 ... Giá vào xem suất diễn tại nhà hát 400 tỷ đồng. Theo thông tin chính thức được công khai trên website chính thức của Đó Theatre, hiện nhà hát mới ...",https://cafef.vn/bo-ra-400-ty-dong-xay-nha-hat-hinh-chiec-do-kdi-holdings-dang-thu-ve-nhung-dong-von-dau-tien-gia-ve-khong-phai-dang-vua-nhung-ngay-ngay-dau-da-kin-cho-188230416144126305.chn,
Nhà hát tư nhân hình chiếc Đó duy nhất Việt Nam,"Apr 16, 2023 ... Vào đầu tháng 4/2023, nhà hát tư nhân đầu tiên tại Việt Nam mang tên Nhà hát ĐÓ đã được khai trương tại dự án Vegacity (khu vực Bãi Tiên, phường ...",https://cafef.vn/nha-hat-tu-nhan-hinh-chiec-do-duy-nhat-tai-viet-nam-va-du-an-trong-chuoi-nuoi-heo-cua-cuu-chu-tich-sacombank-188230416084008204.chn,
Người tạm thay NSND Xuân Bắc điều hành Nhà hát Kịch Việt Nam,"Nov 9, 2024 ... NSƯT Kiều Minh Hiếu sinh năm 1975, gắn bó với Nhà hát Kịch Việt Nam gần 30 năm. Anh từng giữ vị trí Trưởng đoàn Kịch cổ điển trước khi đảm nhận ...",https://cafef.vn/nguoi-tam-thay-nsnd-xuan-bac-dieu-hanh-nha-hat-kich-viet-nam-188241109091452938.chn,
"Hơn cả một biểu tượng, nhà hát mang lại gì cho những thành phố ...","Jul 25, 2022 ... Không chỉ sở hữu kiến trúc nguy nga, tráng lệ và bề dày lịch sử, các nhà hát opera còn là nơi chứa đựng tinh hoa nghệ thuật cũng như là cầu ...",https://m.cafef.vn/hon-ca-mot-bieu-tuong-nha-hat-mang-lai-gi-cho-nhung-thanh-pho-noi-tieng-20220725205520825.chn,
Nhan sắc vợ Thiếu tá kém 10 tuổi của nam NSƯT là Phó Giám đốc ...,"Aug 8, 2024 ... Nam nghệ sĩ chọn về công tác tại Nhà hát Kịch nói Quân đội sau khi tốt nghiệp dù trước đó không có ý định theo nghiệp diễn. Anh từng giành nhiều ...",https://cafef.vn/nhan-sac-vo-thieu-ta-kem-10-tuoi-cua-nam-nsut-la-pho-giam-doc-nha-hat-kich-noi-quan-doi-18824080811372493.chn,
"Cận cảnh Nhà hát hồ Gươm 5.000 m2 tại vị trí đất ""kim cương"" của ...","Jul 9, 2023 ... Ngày 9-7, Bộ Công an và UBND TP Hà Nội tổ chức Lễ khánh thành Nhà hát Hồ Gươm, số 40 Hàng Bài, quận Hoàn Kiếm, TP Hà Nội.",https://cafef.vn/can-canh-nha-hat-ho-guom-5000-m2-tai-vi-tri-dat-kim-cuong-cua-ha-noi-18823070917040976.chn,
"Nhan sắc vợ thiếu tá của nam NSND, Phó giám đốc Nhà hát Chèo ...","Nov 22, 2024 ... Nhan sắc vợ thiếu tá của nam NSND, Phó giám đốc Nhà hát Chèo Quân. Vì cùng làm nghệ thuật và phục vụ trong quân đội nên Tự Long và vợ luôn thông ...",https://cafef.vn/nhan-sac-vo-thieu-ta-cua-nam-nsnd-pho-giam-doc-nha-hat-cheo-quan-doi-lien-tuc-gay-sot-mang-xa-hoi-188241122080945843.chn,
Nam NSND là Phó Giám đốc Nhà hát Chèo Quân đội đăng status ...,"Nov 6, 2024 ... Chia sẻ của nam NSND là Phó Giám đốc Nhà hát Chèo Quân đội về ca sĩ Phan Đinh Tùng thu hút nhiều sự chú ý của cư dân mạng. ... Mới đây, Đại tá, ...",https://cafef.vn/nam-nsnd-la-pho-giam-doc-nha-hat-cheo-quan-doi-dang-status-noi-ve-phan-dinh-tung-1882411052223547.chn,
Nam NSND làm giám đốc Nhà hát kịch Hà Nội: U50 lấy vợ hot girl ...,"Jul 16, 2024 ... Nam NSND làm giám đốc, sống kín tiếng! Nam NSND làm giám đốc Nhà hát kịch Hà Nội: U50 lấy vợ hot girl. NSND Trung Hiếu.",https://cafef.vn/nam-nsnd-lam-giam-doc-nha-hat-kich-ha-noi-u50-lay-vo-hot-girl-kem-19-tuoi-khang-dinh-cuoc-song-hon-nhan-rat-tuyet-voi-188240716173049302.chn,
Những nhà hát hoành tráng nhất từ thời cổ đại được bảo tồn tới ...,"Jun 2, 2013 ... Nằm ở sườn phía nam của Acropolis Athens, nhà hát Odeon được xây dựng vào năm 161 bởi Herodes Atticus – người giàu có nhất Athens - để tưởng ...",https://cafef.vn/noi-that-phong-thuy/nhung-nha-hat-hoanh-trang-nhat-tu-thoi-co-dai-duoc-bao-ton-toi-ngay-nay-2013060118521340018.chn,
Bóng Ma Nhà Hát: Vở kịch lâu đời nhất lịch sử Boardway đi đến hồi ...,"Apr 18, 2023 ... Nội dung của tác phẩm là cuộc tình của Phantom, một người đàn ông với tiếng hát thiên phú nhưng lại mang khuôn mặt dị dạng và bị người đời ruồng ...",https://vietbao.vn/bong-ma-nha-hat-vo-kich-lau-doi-nhat-lich-su-boardway-di-den-hoi-ket-421688.html,
Cụ ông Bắc Ninh hát hay như 'nuốt đĩa' trong đám cưới gây sốt ...,"Apr 2, 2024 ... Mỗi lần vợ chồng tôi vào nhà hàng Việt Nam, chồng luôn dặn tôi gọi món canh chua, cá kho tộ, ăn cùng cơm trắng, đúng khẩu vị của người miền Tây ...",https://vietbao.vn/cu-ong-bac-ninh-hat-hay-nhu-nuot-dia-trong-dam-cuoi-gay-sot-mang-xa-hoi-479471.html,
"Tin tức, hình ảnh, video clip mới nhất về Nhà hát Dolby",Nữ diễn viên 27 tuổi Liza Koshy đang tạo dáng thì bất ngờ ngã vì đôi giày cao phản chủ trên thảm đỏ lễ trao giải Oscar 2024.,https://vietbao.vn/nha-hat-dolby-ptag.html,
TPHCM tạm dừng đầu tư Nhà hát Thủ Thiêm,"Aug 24, 2022 ... TPHCM tạm dừng đầu tư Nhà hát Thủ Thiêm ... Nhà hát Thủ Thiêm với tổng mức đầu tư hơn 1.500 tỷ đồng là một trong 2 dự án lớn của TPHCM phải tạm ...",https://vietbao.vn/tphcm-tam-dung-dau-tu-nha-hat-thu-thiem-378018.html,
Bên trong khán phòng nhà hát có 341 ghế Đồng Kỵ gây tranh cãi ở ...,"May 16, 2023 ... Khán phòng nhà hát dân ca quan họ Bắc Ninh có 341 ghế gõ đỏ do nghệ nhân làng nghề Đồng Kỵ sản xuất đang gây xôn xao dư luận nhiều ngày nay.",https://vietbao.vn/ben-trong-khan-phong-nha-hat-co-341-ghe-dong-ky-gay-tranh-cai-o-bac-ninh-427285.html,
Thời sự 24 giờ: Ghế trong Nhà hát Quan họ Bắc Ninh làm từ gỗ gì ...,"May 15, 2023 ... Bằng các biện pháp nghiệp vụ, Công an tỉnh Lạng Sơn bắt được nghi phạm sát hại cặp vợ chồng ở huyện Hữu Lũng khi tên này đang lổn trốn tại Bắc ...",https://vietbao.vn/thoi-su-24-gio-ghe-trong-nha-hat-quan-ho-bac-ninh-lam-tu-go-gi-gia-bao-nhieu-dinh-chi-2-can-bo-y-te-tiem-vac-xin-het-han-cho-tre-em-427092.html,
Khi biểu tượng văn hóa Sài Gòn một thuở xuống cấp,"Oct 25, 2023 ... HCM càng hư hại nghiêm trọng, bốc mùi ẩm, mốc do bị thấm nước nhiều năm. W-nha-hat-tphcm-18-3.jpg Nhiều năm qua, Nhà hát TP.HCM chủ động sửa ...",https://vietbao.vn/khi-bieu-tuong-van-hoa-sai-gon-mot-thuo-xuong-cap-453948.html,
Giữ hồn hát bội ở TP.HCM: Nối dài giai điệu trăm năm,"Dec 5, 2023 ... Ảnh: Nhà hát Nghệ thuật Hát bội TP.HCM. Tại những vùng quê khi xưa, vào các dịp lễ cúng Thành Hoàng, người dân trong làng thường tụ họp vui hội ...",https://vietbao.vn/giu-hon-hat-boi-o-tp-hcm-noi-dai-giai-dieu-tram-nam-461144.html,
"Hồ Hoài Anh, Hồng Đăng nghỉ việc: Tự trọng nghệ sĩ và chuyện ...","Dec 15, 2023 ... NSND Trung Hiếu, Giám đốc Nhà hát kịch Hà Nội trả lời trên báo Dân Trí rằng diễn viên Hồng Đăng đã chủ động xin nghỉ việc vào cuối năm 2022 và ...",https://vietbao.vn/ho-hoai-anh-hong-dang-nghi-viec-tu-trong-nghe-si-va-chuyen-phong-sat-463773.html,
"Toàn cảnh Hồ Tây: Dày đặc nhà cao tầng vây quanh, vắng bóng cây ...","Sep 12, 2022 ... Bán đảo Quảng An, nơi đây dự kiến sẽ xây nhà hát khoảng 1.600 chỗ ngồi trên diện tích 13.000m2. Toàn cảnh Hồ Tây: Dày đặc nhà cao tầng vây quanh ...",https://vietbao.vn/toan-canh-ho-tay-day-dac-nha-cao-tang-vay-quanh-vang-bong-cay-xanh-382154.html,
Sống động nhà hát mô phỏng Trái đất trị giá 2 tỷ USD ở Las Vegas,"Jul 10, 2023 ... Công trình kiến trúc nhà hát hình cầu khổng lồ tại Las Vegas (Mỹ) sẽ chính thức mở cửa vào tháng 9/2023.",https://kenh14.vn/song-dong-nha-hat-mo-phong-trai-dat-tri-gia-2-ty-usd-o-las-vegas-20230710112733959.chn,
"Old Trafford - ""Nhà hát của những giấc mơ""","May 15, 2010 ... Old Trafford được thiết kế hiện đại bậc nhất với các khu vực dành cho ban huấn luyện, phòng kiểm soát an ninh, khu tác nghiệp truyền hình, các ...",https://kenh14.vn/sport/old-trafford-nha-hat-cua-nhung-giac-mo-20100706024226336.chn,
NHÀ HÁT OPERA SYDNEY: tin tức Mới nhất Thảm họa cháy rừng ...,"Nhà hát Opera Sydney, tin tức hình ảnh mới nhất luôn được cập nhật liên tục, chủ đề nha hat opera sydney : Hiện giờ, khói dày độc hại đang tiếp tục bao phủ ...",https://kenh14.vn/nha-hat-opera-sydney.html,
"Hơn cả một biểu tượng, nhà hát mang lại gì cho những thành phố ...","Jul 25, 2022 ... Không chỉ sở hữu kiến trúc nguy nga, tráng lệ và bề dày lịch sử, các nhà hát opera còn là nơi chứa đựng tinh hoa nghệ thuật cũng như là cầu ...",https://kenh14.vn/hon-ca-mot-bieu-tuong-nha-hat-mang-lai-gi-cho-nhung-thanh-pho-noi-tieng-20220725100239183.chn,
Thảm họa cháy rừng lớn nhất lịch sử Úc: Nhà hát Opera Sydney ...,"Dec 21, 2019 ... Thảm họa cháy rừng lớn nhất lịch sử Úc: Nhà hát Opera Sydney khuất sau khói mù, 2 người thiệt mạng khi tình nguyện dập lửa khiến cả nước xót ...",https://kenh14.vn/tham-hoa-chay-rung-lon-nhat-lich-su-uc-nha-hat-opera-sydney-khuat-sau-khoi-mu-2-nguoi-thiet-mang-khi-tinh-nguyen-dap-lua-khien-ca-nuoc-xot-thuong-20191221124520957.chn,
MAMA 2017 tổ chức tại Nhà hát Hòa Bình 2.500 chỗ ngồi: Có gì đó ...,"Trong khi 2 địa điểm khác của MAMA 2017 Yokohama Arena (Nhật Bản) có sức chứa hơn 17.000 người, Asia-World Expo (Hồng Kông) với sức chứa 14.000 người, ...",https://kenh14.vn/mama-2017-tam-co-chau-luc-lai-to-chuc-tai-nha-hat-hoa-binh-chi-von-ven-2500-cho-ngoi-co-gi-do-sai-sai-20170911010039805.chn,
Trà đào nhà hát - thức uống làm “chao đảo” giới trẻ TP.HCM một ...,"Sep 11, 2022 ... Có nhiều sự lí giải về hàng trà sữa không bao giờ hết đông này, có thể là quán nằm ngay trục đường đẹp của thành phố, lại nằm giữa nhà hát nguy ...",https://kenh14.vn/tra-dao-nha-hat-thuc-uong-lam-chao-dao-gioi-tre-tphcm-mot-thoi-bay-gio-dong-khach-den-dau-20220911142504499.chn,
"Lý do hàng nghìn người đổ về Nhà hát Lớn Hà Nội hôm nay, tắc 5 ...","Ghi nhận vào khoảng 15h ngày 24/11, dù phải khoảng hơn 4 tiếng đồng hồ nữa đêm nhạc mới chính thức diễn ra nhưng ngay từ lúc này, Nhà hát Lớn Hà Nội đã chật kín ...",https://kenh14.vn/ly-do-hang-nghin-nguoi-do-ve-nha-hat-lon-ha-noi-hom-nay-tac-5-nga-duong-215241124181447474.chn,
NSND Công Lý chính thức được bổ nhiệm làm PGĐ Nhà hát Kịch ...,"May 5, 2020 ... ""Cô Đẩu"" Công Lý, NSƯT Trần Hạnh được xét tặng danh hiệu NSND. NSND Công Lý chính thức được bổ nhiệm làm PGĐ Nhà hát Kịch, bạn gái. Hơn kém nhau ...",https://kenh14.vn/nsnd-cong-ly-chinh-thuc-duoc-bo-nhiem-lam-pgd-nha-hat-kich-ban-gai-day-tu-hao-du-o-vi-tri-nao-anh-van-luon-la-nguoi-em-chinh-do-cho-20200507142923453.chn,
"Nhiều người hoảng hốt khi đi ""Highlands Nhà hát Lớn"": Đồng giá ...","Feb 17, 2024 ... Tại Hà Nội, bên cạnh hàng loạt quán cà phê thì chi nhánh ""Highlands Nhà Hát Lớn"" đã trở thành địa điểm quen thuộc của nhiều người dân Thủ đô.",https://kenh14.vn/nhieu-nguoi-hoang-hot-khi-di-highlands-nha-hat-lon-dong-gia-99k-moi-thu-ve-thuong-hieu-deu-bi-an-20240217123507974.chn,
Nghĩa của từ Nhà hát - Từ điển Việt - Việt,Danh từ · nhà lớn chuyên dùng làm nơi trình diễn các tiết mục nghệ thuật sân khấu cho công chúng xem · đơn vị hành chính của ngành sân khấu.,http://tratu.soha.vn/dict/vn_vn/Nh%C3%A0_h%C3%A1t,
"Hơn cả một biểu tượng, nhà hát mang lại gì cho những thành phố ...","Jul 25, 2022 ... Không chỉ sở hữu kiến trúc nguy nga, tráng lệ và bề dày lịch sử, các nhà hát opera còn là nơi chứa đựng tinh hoa nghệ thuật cũng như là cầu ...",https://m.soha.vn/hon-ca-mot-bieu-tuong-nha-hat-mang-lai-gi-cho-nhung-thanh-pho-noi-tieng-20220726091244754.htm,
Người tạm thay NSND Xuân Bắc điều hành Nhà hát Kịch Việt Nam,"Nov 9, 2024 ... NSƯT Kiều Minh Hiếu - Phó Giám đốc Nhà hát Kịch Việt Nam sẽ điều hành hoạt động và đứng tên chủ tài khoản của nhà hát trong thời gian triển ...",https://soha.vn/nguoi-tam-thay-nsnd-xuan-bac-dieu-hanh-nha-hat-kich-viet-nam-198241109082723667.htm,
"Lý do hàng nghìn người đổ về Nhà hát Lớn Hà Nội hôm nay, tắc 5 ...","Nov 24, 2024 ... Ghi nhận vào khoảng 15h ngày 24/11, dù phải khoảng hơn 4 tiếng đồng hồ nữa đêm nhạc mới chính thức diễn ra nhưng ngay từ lúc này, Nhà hát Lớn Hà ...",https://soha.vn/ly-do-hang-nghin-nguoi-do-ve-nha-hat-lon-ha-noi-hom-nay-tac-5-nga-duong-198241124183102487.htm,
Nguyên quyền giám đốc Nhà hát Tuổi trẻ khoe nhà ở khu đất đắt đỏ ...,"Nov 21, 2024 ... Chí Trung được biết đến là một nghệ sĩ nổi tiếng trên sân khấu và truyền hình. Sau nhiều năm công tác ở Nhà hát Tuổi trẻ, ngày 1 tháng 6 năm ...",https://soha.vn/nguyen-quyen-giam-doc-nha-hat-tuoi-tre-khoe-nha-o-khu-dat-dat-do-danh-cho-cac-nghe-si-danh-gia-19824112116594236.htm,
"Nam Đại tá là NSND, Phó Giám đốc Nhà hát Chèo Quân đội đăng ...","Nov 10, 2024 ... Thanh Duy sinh năm 1986 tại Trà Vinh. Nam nghệ sĩ được đánh già là người đa tài ở cả diễn xuất và MC. Tự Long và Thanh Duy từng hợp tác với nhau ...",https://soha.vn/nam-dai-ta-la-nsnd-pho-giam-doc-nha-hat-cheo-quan-doi-dang-status-gan-300-chu-noi-ve-thanh-duy-198241110190552678.htm,
Sống động nhà hát mô phỏng Trái đất trị giá 2 tỷ USD ở Las Vegas,"Jul 11, 2023 ... Công trình kiến trúc nhà hát hình cầu khổng lồ tại Las Vegas (Mỹ) sẽ chính thức mở cửa vào tháng 9/2023, hứa hẹn mang đến những màn trình ...",https://soha.vn/song-dong-nha-hat-mo-phong-trai-dat-tri-gia-2-ty-usd-o-las-vegas-20230711013747945.htm,
Bất ngờ với tiền lương Giám đốc Nhà hát chèo Việt Nam,"Jan 29, 2014 ... (Soha.vn) - NSƯT Thanh Ngoan - Giám đốc Nhà hát chèo VN tiết lộ nhân viên của Nhà hát ít nhất sẽ có tháng lương thứ 13 làm thưởng Tết.",https://soha.vn/van-hoa/bat-ngo-voi-tien-luong-giam-doc-nha-hat-cheo-viet-nam-20140109230927894.htm,
"Cuộc sống viên mãn của 2 nam Đại tá là NSND, Giám đốc, Phó ...","Nov 9, 2024 ... 2 nam Đại tá là NSND, Giám đốc, Phó giám đốc Nhà hát Chèo Quân đội không chỉ có sự nghiệp rực rỡ mà còn có cuộc sống hôn nhân viên mãn, ...",https://soha.vn/cuoc-song-vien-man-cua-2-nam-dai-ta-la-nsnd-giam-doc-pho-giam-doc-nha-hat-cheo-quan-doi-198241108235140289.htm,
Nhan sắc vợ của nam NSND là Giám đốc Nhà hát Ca múa nhạc ...,"Jul 25, 2024 ... Nhan sắc vợ của nam NSND là Giám đốc Nhà hát Ca múa nhạc Thăng Long. NSND Thu Huyền gây ấn tượng với nhiều vai diễn như Thị Mầu, Súy Vân, Hoạn ...",https://soha.vn/nhan-sac-vo-cua-nam-nsnd-la-giam-doc-nha-hat-ca-mua-nhac-thang-long-19824072516552452.htm,
Cùng ngắm nhìn nhà hát Hamburg - Công trình được thiết kế và thi ...,"Jun 30, 2017 ... Nếu bạn đang thắc mắc, công trình kiến trúc nào là biểu tượng của thế kỉ 21. The Elbphilharmonie - Nhà hát Hamburg chính là câu trả lời dành ...",https://genk.vn/cung-ngam-nhin-nha-hat-hamburg-cong-trinh-duoc-thiet-ke-va-thi-cong-trong-16-nam-bieu-tuong-cua-kien-truc-the-ky-21-20170504143554084.chn,
Bên trong Nhà hát Steve Jobs - nơi diễn ra sự kiện Apple - một tuyệt ...,"Sep 20, 2017 ... Toàn bộ diện tích của Steve Jobs Theater là khoảng 15,500 mét vuông, trong đó những khu vực như phòng trưng bày hay hội trường nằm sâu phía dưới ...",https://genk.vn/ben-trong-nha-hat-steve-jobs-noi-dien-ra-su-kien-apple-mot-tuyet-tac-nhu-chinh-chiec-iphone-vay-20170916111725915.chn,
"Gần 3.650 ngày thi công, ""nhà hát dưới lòng đất"" thuộc tuyến metro ...","Oct 25, 2023 ... Theo Ban Quản lý đường sắt đô thị TP.HCM, ga Nhà hát Thành phố của tuyến metro Bến Thành - Suối Tiên đã cơ bản hoàn thành sau gần 10 năm thi ...",https://genk.vn/gan-3650-ngay-thi-cong-nha-hat-duoi-long-dat-thuoc-tuyen-metro-43700-ty-co-gi-20231025151429096.chn,
"Trải nghiệm ""Nhà hát của những giấc mơ"" ngay tại nhà trong trận ...","Dec 6, 2023 ... Một chiếc TV màn hình lớn với chất lượng nghe nhìn xứng tầm vào dịp này sẽ là một món quà 2-trong-1 cho fan thể thao, vừa trải nghiệm mãn nhãn ...",https://genk.vn/trai-nghiem-nha-hat-cua-nhung-giac-mo-ngay-tai-nha-trong-tran-kinh-dien-mu-va-chelsea-20231206173029744.chn,
Đến lượt nhà hát opera ở Sydney thắt chặt sử dụng gậy tự sướng,"Jul 8, 2015 ... Nhà hát nổi tiếng Sydney (Sydney Opera House) ở Úc vừa ra những quy định cụ thể liên quan đến việc cấm sử dụng ""gậy tự sướng"" trong một số ...",https://genk.vn/den-luot-nha-hat-opera-o-sydney-that-chat-su-dung-gay-tu-suong-2015070618353031.chn,
"Nhà hát Steve Jobs sẽ sử dụng thang máy quay và ""bức tường ẩn ...","Sep 8, 2017 ... Apple sẽ cho ra mắt iPhone 8 vào ngày 12 tháng 9 tới tại khuôn viên Apple Park (Cupertino, California). Tuy nhiên, rất có thể iPhone 8 không ...",https://genk.vn/nha-hat-steve-jobs-se-su-dung-thang-may-quay-va-buc-tuong-an-trong-ngay-ra-mat-iphone-8-20170907141333836.chn,
Cận cảnh Apple Park: Văn phòng đẹp nhất thế giới trị giá 5 tỷ USD ...,"Sep 14, 2021 ... Thế giới sẽ một lần nữa quay trở lại Apple Park và Nhà hát Steve Jobs ở Cupertino, Mỹ. Đây là nơi sẽ diễn ra sự kiện ra mắt iPhone 13 và các ...",https://genk.vn/can-canh-apple-park-van-phong-dep-nhat-the-gioi-tri-gia-5-ty-usd-noi-to-chuc-buoi-ra-mat-iphone-13-dem-nay-20210914224017108.chn,
Kinh ngạc TTTM khổng lồ của Trung Quốc: Lớn gấp 20 lần nhà hát ...,"Sep 30, 2023 ... Tại thủ phủ tỉnh Tứ Xuyên, một trong những đô thị phát triển nhanh chóng bậc nhất Trung Quốc với hơn 14 triệu dân, New Century Global Centre ( ...",https://genk.vn/kinh-ngac-tttm-khong-lo-cua-trung-quoc-lon-gap-20-lan-nha-hat-opera-bien-khong-lo-ngay-trong-nha-mat-troi-nhan-tao-chieu-sang-24-7-20230930103006762.chn,
Đón Haloween với chiếc mặt nạ kinh dị sẽ giúp bạn học lập trình AI,"Oct 19, 2017 ... Chiếc mặt nạ kinh dị theo phong cách ''Bóng ma trong nhà hát'' này hứa hẹn sẽ giúp bạn học cách lập trình AI để tự tạo ra một con robot ...",https://genk.vn/don-haloween-voi-chiec-mat-na-kinh-di-se-giup-ban-hoc-lap-trinh-ai-20171019093124179.chn,
10 công trình có khối lượng khổng lồ mà con người từng di chuyển,"Apr 3, 2015 ... Nhà hát nghệ thuật Shubert – 2908 tấn. Nhà hát cổ kính nhất ở Minneapolis, với khối lượng 2908 tấn. Mở cửa từ những năm 1910, nơi đây từng ...",https://genk.vn/10-cong-trinh-co-khoi-luong-khong-lo-ma-con-nguoi-tung-di-chuyen-20150402231124272.chn,
Hà Nội dự kiến xây dựng nhà hát rộng 13.000 m2 sát Hồ Tây - Báo ...,"Nov 28, 2024 ... Điểm nhấn của đồ án là công trình nhà hát được xây dựng sát Hồ Tây. Theo phương án đã được đưa ra lấy ý kiến nhân dân trước đó, nhà hát có diện ...",https://vnexpress.net/ha-noi-du-kien-xay-dung-nha-hat-rong-13-000-m2-sat-ho-tay-4821450.html,
Hà Anh Tuấn hát trước 2.600 khán giả ở nhà hát Opera Sydney ...,"Sep 30, 2024 ... Hà Anh Tuấn hát trước 2.600 khán giả ở nhà hát Opera Sydney. AustraliaHà Anh Tuấn hát hơn 20 bài trong live concert ""Sketch a Rose"", xúc động ...",https://vnexpress.net/ha-anh-tuan-hat-truoc-2-600-khan-gia-o-nha-hat-opera-sydney-4798319.html,
Quá trình xây dựng trắc trở của kỳ quan - Nhà hát Opera Sydney ...,19 hours ago ... Australia- Việc khởi công trước khi hoàn thiện thiết kế và mái vòm phức tạp gồm nhiều mảnh khiến quá trình xây Nhà hát Opera Sydney bị kéo ...,https://vnexpress.net/qua-trinh-xay-dung-trac-tro-cua-ky-quan-nha-hat-opera-sydney-4837085.html,
Nghệ sĩ Tự Long làm giám đốc Nhà hát Chèo Quân đội - Báo ...,"Dec 30, 2024 ... Nghệ sĩ Tự Long được bổ nhiệm làm giám đốc Nhà hát Chèo Quân đội, thay nghệ sĩ Quốc Trượng nghỉ hưu. - VnExpress.",https://vnexpress.net/nghe-si-tu-long-lam-giam-doc-nha-hat-cheo-quan-doi-4833812.html,
Nhà hát quan họ đoạt giải nhì kiến trúc quốc gia - Báo VnExpress,"May 15, 2023 ... Nhà hát quan họ đoạt giải nhì kiến trúc quốc gia · Lối đi sảnh tầng một nhà hát, bên trái là hàng ghế gỗ ngồi chờ, bên phải là các tủ trưng bày ...",https://vnexpress.net/nha-hat-quan-ho-doat-giai-nhi-kien-truc-quoc-gia-4605494.html,
Khánh thành Nhà hát Hồ Gươm - Báo VnExpress,"Jul 9, 2023 ... Nhà hát Hồ Gươm tọa lạc tại số 40-40A Hàng Bài (quận Hoàn Kiếm), được khởi công tháng 10/2021. Công trình được xây dựng trên khu đất hơn 5.000 ...",https://vnexpress.net/khanh-thanh-nha-hat-ho-guom-4626786.html,
Hà Nội dự kiến xây nhà hát sát Hồ Tây - Báo VnExpress,"Jul 13, 2022 ... Nhà hát có diện tích khoảng 13.000 m2, thiết kế nổi trên mặt hồ Đầm Trị, sẽ là không gian trình diễn nghệ thuật, tổ chức các sự kiện văn hóa ...",https://vnexpress.net/ha-noi-du-kien-xay-nha-hat-sat-ho-tay-4486917.html,
Nhà hát giao hưởng 1.000 chỗ ở Vĩnh Phúc thường xuyên đóng cửa ...,"Oct 19, 2018 ... Cách trung tâm Hà Nội 50 km với hơn một giờ lái xe, nhà hát Vĩnh Phúc được đánh giá là một trong những nhà hát giao hưởng có quy mô lớn nhất cả ...",https://vnexpress.net/nha-hat-giao-huong-1-000-cho-o-vinh-phuc-thuong-xuyen-dong-cua-3825909.html,
Quy mô các nhà hát giao hưởng hàng đầu thế giới - Báo VnExpress ...,"Oct 13, 2018 ... Công trình rộng 60.000 mét vuông, có hình dáng vỏ trái sầu riêng. Đây là cụm phức hợp gồm sáu địa điểm biểu diễn, trong đó rạp hát có sức chứa ...",https://vnexpress.net/quy-mo-cac-nha-ha-t-giao-huo-ng-hang-dau-the-gio-i-3822372.html,
