Title,Snippet,URL,Topics
Các nhà hát ở TP HCM đang hoạt động ra sao - Báo VnExpress Giải ...,"Oct 12, 2018 ... Nhà hát Bến Thành (quận 1) có hai lầu với sức chứa hơn 1.000 ghế. Những năm gần đây, nhà hát cải tiến hơn về âm thanh với hệ thống máy móc do ...",https://vnexpress.net/cac-nha-hat-o-tp-hcm-dang-hoat-dong-ra-sao-3822730.html,
Chân dung vợ Phó giám đốc Nhà hát Kịch nói Quân đội: Là nữ thiếu ...,"Sep 25, 2024 ... Đặc biệt hơn, nữ diễn viên sinh năm 1987 là một nữ quân nhân chuyên nghiệp mang hàm thiếu tá, thuộc quân số Nhà hát Kịch nói Quân đội. Chồng cô ...",https://baomoi.com/chan-dung-vo-pho-giam-doc-nha-hat-kich-noi-quan-doi-la-nu-thieu-ta-xinh-dep-sac-voc-van-nguoi-me-c50270869.epi,
Nhà hát Lớn Hà Nội được xây dựng như thế nào? - Tạp chí Tri thức,"Jul 28, 2020 ... Phần xây nhô phía trước là một cầu thang bộ rộng rãi dùng làm lối vào cho người đi bộ; hai bên là 2 cổng dành cho ôtô; cả ba đều dẫn đến sảnh ...",https://baomoi.com/nha-hat-lon-ha-noi-duoc-xay-dung-nhu-the-nao-c35836864.epi,
Nhà hát Lớn Hà Nội bị xâm hại: Chấm dứt hoạt động của Highlands ...,"Nov 22, 2022 ... Hoàn Kiếm) bị xâm hại, đại diện Ban Quản lý Nhà hát Lớn Hà Nội cho biết, đơn vị sẽ chấm dứt hoạt động kinh doanh của Highlands Coffee và có tờ ...",https://baomoi.com/nha-hat-lon-ha-noi-bi-xam-hai-cham-dut-hoat-dong-cua-highlands-coffee-c44343677.epi,
Nhà hát Lớn Hà Nội dự kiến đóng cửa cả năm 2024 để tu bổ - Báo ...,"Apr 4, 2023 ... Theo bà Nguyệt, dự án tu bổ, tôn tạo công trình Nhà hát Lớn dự kiến kéo dài từ 2023 đến 2025, song do nhà hát là đơn vị tự chủ, nếu đóng cửa kéo ...",https://baomoi.com/nha-hat-lon-ha-noi-du-kien-dong-cua-ca-nam-2024-de-tu-bo-c45467428.epi,
NSƯT Kiều Minh Hiếu đảm nhận vị trí giám đốc Nhà hát Kịch Việt ...,"Nov 8, 2024 ... Theo thông tin mới nhất từ Bộ Văn hóa, Thể thao và Du lịch (Bộ VHTT&DL), Bộ Văn hóa đã giao NSƯT Kiều Minh Hiếu - Phó Giám đốc Nhà hát Kịch Việt ...",https://baomoi.com/nsut-kieu-minh-hieu-dam-nhan-vi-tri-giam-doc-nha-hat-kich-viet-nam-thay-nsnd-xuan-bac-c50665561.epi,
NSƯT Kiều Minh Hiếu thay NSND Xuân Bắc điều hành Nhà hát ...,"Nov 9, 2024 ... Sau khi NSND Xuân Bắc - Giám đốc Nhà hát Kịch Việt Nam được Bộ Văn hóa, Thể thao và Du lịch điều động giữ chức Cục trưởng Cục Nghệ thuật ...",https://baomoi.com/nsut-kieu-minh-hieu-thay-nsnd-xuan-bac-dieu-hanh-nha-hat-kich-viet-nam-c50678853.epi,
"Hôn nhân kín tiếng bên vợ kém 19 tuổi của nam NSND, Giám đốc ...","Aug 15, 2024 ... NSND Trung Hiếu là nghệ sĩ gạo cội của sân khấu kịch đất Bắc, hiện tại anh đang là người đứng đầu Nhà hát Kịch Hà Nội.",https://baomoi.com/hon-nhan-kin-tieng-ben-vo-kem-19-tuoi-cua-nam-nsnd-giam-doc-nha-hat-kich-ha-noi-c49908472.epi,
Người 'kế vị' NSND Xuân Bắc lãnh đạo Nhà hát Kịch Việt Nam là ...,"Nov 8, 2024 ... Nam NSƯT thay NSND Xuân Bắc điều hành Nhà hát Kịch Việt Nam từng tham gia nhiều vở diễn ấn tượng như Kiều, Lâu đài cát, Người thi hành án tử ...",https://baomoi.com/nguoi-ke-vi-nsnd-xuan-bac-lanh-dao-nha-hat-kich-viet-nam-la-nsut-rat-quen-mat-voi-khan-gia-c50668309.epi,
NSND Nguyễn Thị Thu Hà được tặng Giải thưởng Nhà nước về văn ...,"Jul 31, 2023 ... Ngày 19/5/2023, Đại tá, Tiến sĩ, NSND Nguyễn Thị Thu Hà - Giám đốc Nhà hát Nghệ thuật thực hành Trường Đại học Văn hóa Nghệ thuật Quân đội ...",https://baomoi.com/nsnd-nguyen-thi-thu-ha-duoc-tang-giai-thuong-nha-nuoc-ve-van-hoc-nghe-thuat-nam-2022-c46506742.epi,
Bí ẩn 6 'bóng ma' trong nhà hát kịch - Báo Tri thức & Cuộc sống,"Oct 26, 2013 ... 4. Nhà hát hoàng gia Drury Lane, London, Anh: Người dân xứ sở sương mù đồn đại rằng đây là nơi ở của một trong những con ma nổi tiếng nhất nước ...",https://baomoi.com/bi-an-6-bong-ma-trong-nha-hat-kich/c/12263484.epi,
NSND Tự Long giữ chức Giám đốc Nhà hát Chèo Quân đội,"Dec 31, 2024 ... Chiều 30.12, Đại tá, NSND Tự Long nhận quyết định bổ nhiệm vai trò Giám đốc Nhà hát Chèo Quân đội, sau khi Đại tá, NSND Nguyễn Quốc Trượng ...",https://thanhnien.vn/nsnd-tu-long-giu-chuc-giam-doc-nha-hat-cheo-quan-doi-18524123101142834.htm,
Việt Nam có nhà hát opera vào top tuyệt nhất thế giới,"Dec 8, 2023 ... 'Gã khổng lồ' Arup đưa nhà hát Opera Hà Nội lên trang web toàn cầu · Trong bài đăng mới trên trang web chính thức của mình, Arup Engineering ...",https://thanhnien.vn/viet-nam-co-nha-hat-opera-vao-top-tuyet-nhat-the-gioi-185231207194706475.htm,
TP.HCM khởi động lại dự án nhà hát Thủ Thiêm gần 2.000 tỉ đồng,"May 11, 2024 ... Nhà hát có quy mô 1.700 chỗ ngồi, gồm 1 khán phòng lớn 1.200 chỗ và 1 khán phòng nhỏ 500 chỗ. Nhà hát nằm trên lô đất có ký hiệu 1-21 (bên hông ...",https://thanhnien.vn/tphcm-khoi-dong-lai-du-an-nha-hat-thu-thiem-gan-2000-ti-dong-18524051111571958.htm,
Nhà hát Hồ Gươm biểu tượng văn hóa mới của Hà Nội,"Jul 10, 2023 ... Đây là một thiết chế văn hóa với không gian văn hóa nghệ thuật hiện đại xen lẫn truyền thống, có cơ sở vật chất đồng bộ, hiện đại, có kết nối ...",https://thanhnien.vn/nha-hat-ho-guom-bieu-tuong-van-hoa-moi-cua-ha-noi-185230709214832561.htm,
'Những con ma nhà hát' - bi kịch của nghệ thuật,"Jul 10, 2024 ... Sân khấu Thiên Đăng (TP.HCM) vừa công diễn vở Những con ma nhà hát (tác giả Lê Hoàng, đạo diễn NSƯT Thành Lộc) với nội dung sâu cay về nghệ ...",https://thanhnien.vn/nhung-con-ma-nha-hat-bi-kich-cua-nghe-thuat-185240709212043321.htm,
Nhà hát Opera Hà Nội nâng tầm giá trị của Hồ Tây,"Oct 7, 2022 ... Việc xây dựng một nhà hát opera ở Hồ Tây là một công trình hết sức quan trọng đối với Hà Nội, không chỉ tạo nên biểu tượng mới cho thủ đô, giúp ...",https://thanhnien.vn/nha-hat-opera-ha-noi-nang-tam-gia-tri-cua-ho-tay-1851507484.htm,
Cận cảnh kiến trúc ấn tượng của Nhà hát Hồ Gươm,"Jul 9, 2023 ... Nhà hát Hồ Gươm là nhà hát đầu tiên tại Việt Nam được cung cấp loại máy móc thiết bị đạt tiêu chuẩn quốc tế, có khả năng đáp ứng đa dạng yêu cầu ...",https://thanhnien.vn/can-canh-kien-truc-an-tuong-cua-nha-hat-ho-guom-185230709184641072.htm,
Vụ khủng bố Paris: Nhà hát Bataclan là mục tiêu lâu năm của các ...,"Nov 14, 2015 ... (TNO) Từ vài năm qua, nhà hát Bataclan, nơi xảy ra vụ tấn công và tàn sát con tin đêm 13.11 tại thủ đô Paris (Pháp) đã là đích ngắm của ...",https://thanhnien.vn/vu-khung-bo-paris-nha-hat-bataclan-la-muc-tieu-lau-nam-cua-cac-nhom-cuc-doan-185517570.htm,
Hà Nội sẽ có nhà hát Ngọc trai 10.000 tỉ đồng sát hồ Tây,"Nov 28, 2024 ... Đồ án Quy hoạch chi tiết khu vực trục không gian trung tâm bán đảo Quảng An, tỷ lệ 1/500 thể hiện sát hồ Tây (Hà Nội) sẽ được đầu tư xây ...",https://thanhnien.vn/ha-noi-se-co-nha-hat-ngoc-trai-10000-ti-dong-sat-ho-tay-18524112812044703.htm,
Nhà hát Hồ Gươm - góc nhìn từ 'âm học kiến trúc',"Sep 1, 2023 ... Khi Caroline Campbell độc tấu, những thanh âm đầy mê hoặc, những quãng bỏ nhỏ và staccato cực kỳ cá tính và phóng khoáng của cô đã không chỉ phô ...",https://thanhnien.vn/nha-hat-ho-guom-goc-nhin-tu-am-hoc-kien-truc-185230831144746318.htm,
NSND Tự Long giữ chức Giám đốc Nhà hát Chèo Quân đội,"Còn theo quyết định số 133/QĐX-BQP ngày 10/12/2024 của Bộ trưởng Bộ Quốc phòng về việc để Đại tá, NSND Nguyễn Quốc Trượng, Giám đốc Nhà hát Chèo Quân đội nghỉ ...",http://www.msn.com/vi-vn/entertainment/news/nsnd-t%E1%BB%B1-long-gi%E1%BB%AF-ch%E1%BB%A9c-gi%C3%A1m-%C4%91%E1%BB%91c-nh%C3%A0-h%C3%A1t-ch%C3%A8o-qu%C3%A2n-%C4%91%E1%BB%99i/ar-AA1wHH51?apiversion=v2&noservercache=1&domshim=1&renderwebcomponents=1&wcseo=1&batchservertelemetry=1&noservertelemetry=1,
Ai sẽ thay NSND Xuân Bắc làm Giám đốc Nhà hát Kịch Việt Nam?,"Nov 1, 2024 ... Ai sẽ thay NSND Xuân Bắc làm Giám đốc Nhà hát Kịch Việt Nam? ... NSND Xuân Bắc sẽ nhận nhiệm vụ mới là Cục trưởng Cục Nghệ thuật Biểu diễn từ ngày ...",https://www.msn.com/vi-vn/lifestyle/living/ai-s%E1%BA%BD-thay-nsnd-xu%C3%A2n-b%E1%BA%AFc-l%C3%A0m-gi%C3%A1m-%C4%91%E1%BB%91c-nh%C3%A0-h%C3%A1t-k%E1%BB%8Bch-vi%E1%BB%87t-nam/ar-AA1tilCG,
"Cháy quán bar ở tầng hầm Nhà hát Trưng Vương, Đà Nẵng",Vụ cháy quán bar ở tầng hầm đã khiến khói mù mịt bao phủ xung quanh khu vực Nhà hát Trưng Vương ở trung tâm thành phố Đà Nẵng.,https://www.msn.com/vi-vn/news/national/ch%C3%A1y-qu%C3%A1n-bar-%E1%BB%9F-t%E1%BA%A7ng-h%E1%BA%A7m-nh%C3%A0-h%C3%A1t-tr%C6%B0ng-v%C6%B0%C6%A1ng-%C4%91%C3%A0-n%E1%BA%B5ng/ar-AA1s40Z9,
Tự Long làm giám đốc Nhà hát Chèo Quân đội; BTS hoãn lên sóng ...,Một số tin nổi bật: Tự Long làm giám đốc Nhà hát Chèo Quân đội; BTS hoãn lên sóng vì thảm kịch cháy máy bay; Park Sung Hoon gây tranh cãi; Hoa hậu Quốc gia ...,http://www.msn.com/vi-vn/entertainment/news/t%E1%BB%B1-long-l%C3%A0m-gi%C3%A1m-%C4%91%E1%BB%91c-nh%C3%A0-h%C3%A1t-ch%C3%A8o-qu%C3%A2n-%C4%91%E1%BB%99i-bts-ho%C3%A3n-l%C3%AAn-s%C3%B3ng-v%C3%AC-th%E1%BA%A3m-k%E1%BB%8Bch-ch%C3%A1y-m%C3%A1y-bay/ar-AA1wKwQJ?apiversion=v2&noservercache=1&domshim=1&renderwebcomponents=1&wcseo=1&batchservertelemetry=1&noservertelemetry=1,
Nghệ sĩ Tự Long làm giám đốc Nhà hát Chèo Quân đội,"... Nhà hát Chèo Quân đội, thay nghệ sĩ Quốc Trượng nghỉ hưu. Tại lễ nhậm chức chiều 30/12 ở Hà Nội, anh cho biết sẽ cùng tập thể nhà hát phát huy truyền thống ...",http://www.msn.com/vi-vn/entertainment/news/ngh%E1%BB%87-s%C4%A9-t%E1%BB%B1-long-l%C3%A0m-gi%C3%A1m-%C4%91%E1%BB%91c-nh%C3%A0-h%C3%A1t-ch%C3%A8o-qu%C3%A2n-%C4%91%E1%BB%99i/ar-AA1wIfFD?apiversion=v2&noservercache=1&domshim=1&renderwebcomponents=1&wcseo=1&batchservertelemetry=1&noservertelemetry=1,
Nhà hát Kịch Việt Nam 'khai Xuân' với kiệt tác trăm tuổi đến từ nước ...,"Mở đầu cho hoạt động nghệ thuật năm 2024, Nhà hát Kịch Việt Nam giới thiệu vở hài kịch ""Ả cave nhà hàng Maxim"" của tác giả người Pháp, công diễn lần đầu tại ...",https://www.msn.com/vi-vn/lifestyle/living/nh%C3%A0-h%C3%A1t-k%E1%BB%8Bch-vi%E1%BB%87t-nam-khai-xu%C3%A2n-v%E1%BB%9Bi-ki%E1%BB%87t-t%C3%A1c-tr%C4%83m-tu%E1%BB%95i-%C4%91%E1%BA%BFn-t%E1%BB%AB-n%C6%B0%E1%BB%9Bc-ph%C3%A1p/ar-BB1irQ0Z,
NSND Tự Long giữ chức Giám đốc Nhà hát Chèo Quân đội,"TPO - Tại Hội nghị bàn giao chức trách, nhiệm vụ Giám đốc Nhà hát Chèo Quân đội tổ chức ngày 30/12, NSND Tự Long chính thức giữ chức vụ Giám đốc Nhà hát ...",https://www.msn.com/vi-vn/entertainment/news/nsnd-t%E1%BB%B1-long-gi%E1%BB%AF-ch%E1%BB%A9c-gi%C3%A1m-%C4%91%E1%BB%91c-nh%C3%A0-h%C3%A1t-ch%C3%A8o-qu%C3%A2n-%C4%91%E1%BB%99i/ar-AA1wHLsd,
Ai thay thế vị trí giám đốc của NSND Xuân Bắc ở Nhà hát Kịch Việt ...,Lãnh đạo của Nhà hát Kịch Việt Nam sẽ do lãnh đạo Bộ VHTTDL quyết định. Để biết được người kế nhiệm NSND Xuân Bắc vẫn phải đợi thông báo chính thức từ Bộ VHTTDL ...,http://www.msn.com/vi-vn/entertainment/news/ai-thay-th%E1%BA%BF-v%E1%BB%8B-tr%C3%AD-gi%C3%A1m-%C4%91%E1%BB%91c-c%E1%BB%A7a-nsnd-xu%C3%A2n-b%E1%BA%AFc-%E1%BB%9F-nh%C3%A0-h%C3%A1t-k%E1%BB%8Bch-vi%E1%BB%87t-nam/ar-AA1teVj7?apiversion=v2&noservercache=1&domshim=1&renderwebcomponents=1&wcseo=1&batchservertelemetry=1&noservertelemetry=1,
Diễn kịch kỷ niệm 260 năm ngày sinh Đức ông Tả quân Lê Văn Duyệt,"Tối 10-7, tại Nhà hát Thanh Niên, Nhà hát kịch Idecaf sẽ biểu diễn suất kịch đặc biệt mừng 260 năm ngày sinh của đức ông Lê Văn Duyệt.",http://www.msn.com/vi-vn/lifestyle/living/di%E1%BB%85n-k%E1%BB%8Bch-k%E1%BB%B7-ni%E1%BB%87m-260-n%C4%83m-ng%C3%A0y-sinh-%C4%91%E1%BB%A9c-%C3%B4ng-t%E1%BA%A3-qu%C3%A2n-l%C3%AA-v%C4%83n-duy%E1%BB%87t/ar-BB1pM8Lq?apiversion=v2&noservercache=1&domshim=1&renderwebcomponents=1&wcseo=1&batchservertelemetry=1&noservertelemetry=1,
"Duy Hưng, Thanh Hương thắng giải diễn viên ấn tượng","Các màn trình diễn của nghệ sĩ tại Nhà hát Hồ Gươm. VTV Awards 2024 cũng trao giải Gương mặt trẻ ấn tượng cho cho vận động viên Nguyễn Thị Hương, Hình ảnh lan ...",http://www.msn.com/vi-vn/entertainment/news/duy-h%C6%B0ng-thanh-h%C6%B0%C6%A1ng-th%E1%BA%AFng-gi%E1%BA%A3i-di%E1%BB%85n-vi%C3%AAn-%E1%BA%A5n-t%C6%B0%E1%BB%A3ng/ar-AA1wOcJx?apiversion=v2&noservercache=1&domshim=1&renderwebcomponents=1&wcseo=1&batchservertelemetry=1&noservertelemetry=1,
Tổ chức chương trình văn nghệ thuê một nhà hát thì có cần xin giấy ...,"Feb 10, 2021 ... Tổ chức chương trình văn nghệ thuê một nhà hát thì có cần xin giấy phép không? Trường hợp xin phép tổ chức sự kiện.",https://luatduonggia.vn/to-chuc-chuong-trinh-van-nghe-thue-mot-nha-hat-thi-co-can-xin-giay-phep-khong/,
Viết lại lời bài hát có vi phạm bản quyền không?,"Oct 1, 2024 ... Có thể thấy, việc chế lời bài hát là việc sử dụng tác phẩm âm nhạc đã có để phóng tác. ... Trách nhiệm bồi thường thiệt hại do nhà cửa, công trình ...",https://danang.luatduonggia.vn/kien-thuc-phap-luat/viet-lai-loi-bai-hat-co-vi-pham-ban-quyen-khong.html,
Công trình văn hóa là gì? Công trình văn hóa bao gồm?,"Aug 19, 2024 ... Những công trình này, như Trung tâm hội nghị, nhà hát, bảo tàng hay triển lãm mang lại cho người dân cơ hội trải nghiệm tốt hơn và cũng giúp đất ...",https://luatduonggia.vn/cong-trinh-van-hoa-la-gi-cong-trinh-van-hoa-bao-gom/,
"Vi phạm bản quyền âm nhạc, bài hát bị xử phạt như thế nào?","Nov 16, 2022 ... Chủ thể bản quyền ở đây có thể là tác giả, người tạo ra tác phẩm, nhà xuất bản hay các doanh nghiệp được giao bản quyền để phân phối. Theo đó vi ...",https://danang.luatduonggia.vn/kien-thuc-phap-luat/vi-pham-ban-quyen-am-nhac-bai-hat-bi-xu-phat-nhu-the-nao.html,
Tiểu sử cuộc đời và sự nghiệp sáng tác của Nguyễn Huy Tưởng,"Nov 7, 2024 ... Ông là đại biểu Quốc hội khóa I năm 1946, cũng là năm vở kịch Bắc Sơn của ông lần đầu tiên được trình diễn tại Nhà hát Lớn, thu hút sự chú ý lớn ...",https://luatduonggia.vn/tieu-su-cuoc-doi-va-su-nghiep-sang-tac-cua-nguyen-huy-tuong/,
Thủ tục xin cấp phép tổ chức cuộc thi nhảy,"Feb 10, 2021 ... ... nhà hát thì có cần xin giấy phép không? Theo quy định ... Tổ chức chương trình văn nghệ thuê một nhà hát thì có cần xin giấy phép không?",https://luatduonggia.vn/thu-tuc-xin-cap-phep-to-chuc-cuoc-thi-nhay/,
Phân loại và phân cấp công trình xây dựng mới nhất 2023,"Apr 7, 2023 ... + Công trình văn hóa: Trung tâm hội nghị, nhà hát, nhà văn hóa, câu lạc bộ, rạp chiếu phim, rạp xiếc; bảo tàng, thư viện, triển lãm, nhà trưng ...",https://luatduonggia.vn/phan-loai-va-phan-cap-cong-trinh-xay-dung/,
Những bài hát chủ đề giao thông của trẻ em hay nhất,"Aug 29, 2024 ... Lời bài hát. “Lời cô dặn em chẳng dám quên. Tan học về phải đi mau về nhà. Không được la cà đùa giỡn hay rượt nhau. Khi băng qua đường em nhớ ...",https://luatduonggia.vn/nhung-bai-hat-chu-de-giao-thong-cua-tre-em-hay-nhat/,
Tiểu sử cuộc đời và sự nghiệp của William Shakespeare,"Nov 16, 2024 ... Khi bắt đầu sự nghiệp, William Shakespeare học theo nhiều nhà kịch thời đó, lấy cảm hứng từ trong nhà hát London. Nó dựa trên khả năng diễn ...",https://luatduonggia.vn/tieu-su-cuoc-doi-va-su-nghiep-cua-william-shakespeare/,
Chủ nhà trọ không đăng ký tạm trú cho khách bị phạt thế nào?,"Nov 5, 2022 ... – Thông tư số 56/2021/TT-BCA;. 1. Nơi tạm trú là gì? Căn cứ theo quy định tại khoản 9, Điều 2 ...",https://danang.luatduonggia.vn/hanh-chinh/chu-nha-tro-khong-dang-ky-tam-tru-cho-khach-bi-phat-the-nao.html,
Nhà hát (kiến trúc) – Wikipedia tiếng Việt,"Nhà hát (kiến trúc) ... Nhà hát hay Kịch viện là một cấu trúc nơi các tác phẩm sân khấu hoặc vở kịch được biểu diễn, hoặc các buổi biểu diễn khác như buổi hòa ...",https://vi.wikipedia.org/wiki/Nh%C3%A0_h%C3%A1t_(ki%E1%BA%BFn_tr%C3%BAc),
Nhà hát Thành phố Hồ Chí Minh – Wikipedia tiếng Việt,"Nằm ở một vị trí thuận lợi tại trung tâm thành phố, nhà hát được xem là nhà hát trung tâm, đa năng chuyên tổ chức biểu diễn sân khấu nghệ thuật đồng thời cũng ...",https://vi.wikipedia.org/wiki/Nh%C3%A0_h%C3%A1t_Th%C3%A0nh_ph%E1%BB%91_H%E1%BB%93_Ch%C3%AD_Minh,
Nhà hát Chicago – Wikipedia tiếng Việt,"Nhà hát Chicago ... Nhà hát Chicago, ban đầu có tên là Nhà hát Balaban và Katz Chicago, là một nhà hát nằm trên ở phía bắc Phố State trong khu vực Loop của ...",https://vi.wikipedia.org/wiki/Nh%C3%A0_h%C3%A1t_Chicago,
Nhà hát Hòa Bình – Wikipedia tiếng Việt,"Công trình khánh thành và đưa vào sử dụng từ ngày 26 tháng 4 năm 1985. ... Đến nay, đây là nhà hát duy nhất có sân khấu đủ rộng và sâu để thiết kế nên một sân ...",https://vi.wikipedia.org/wiki/Nh%C3%A0_h%C3%A1t_H%C3%B2a_B%C3%ACnh,
Nhà hát Broadway – Wikipedia tiếng Việt,"Nhà hát Broadway ... Đừng nhầm lẫn với Sân khấu Broadway, một hệ thống 41 nhà hát ở thành phố New York, Mỹ. Nhà hát Broadway (tiếng Anh: Broadway Theatre) là một ...",https://vi.wikipedia.org/wiki/Nh%C3%A0_h%C3%A1t_Broadway,
Nhà hát Opera Sydney – Wikipedia tiếng Việt,"Nhà hát Opera Sydney ... Nhà hát Opera Sydney, được người Việt gọi là Nhà hát Con Sò) là một công trình nhà hát tại thành phố Sydney, Úc. Nhà hát có kiến trúc độc ...",https://vi.wikipedia.org/wiki/Nh%C3%A0_h%C3%A1t_Opera_Sydney,
Nhà hát Bolshoi – Wikipedia tiếng Việt,"Nhà hát Bolshoi ... Nhà hát Bolshoi (tiếng Nga: Большой театр, Bol'shoy teatr, có nghĩa là Nhà hát lớn) Còn đánh vần Bolshoy là một nhà hát lịch sử tại Moskva, ...",https://vi.wikipedia.org/wiki/Nh%C3%A0_h%C3%A1t_Bolshoi,"ti ng Nga Большой, театр Bol shoy teatr"
Nhà hát Sông Hương – Wikipedia tiếng Việt,"Nhà hát Sông Hương được đánh giá là công trình có vị trí ấn tượng tại Huế – xứ Huế, xứ sở mộng mơ, thành phố thơ mộng hay xứ thơ hàng đầu miền Trung nước Việt ...",https://vi.wikipedia.org/wiki/Nh%C3%A0_h%C3%A1t_S%C3%B4ng_H%C6%B0%C6%A1ng,
Nhà hát Benaroya – Wikipedia tiếng Việt,"Nhà hát Benaroya ... Đối với album của Pearl Jam, xem Live at Benaroya Hall. Nhà hát Benaroya là nhà của dàn nhạc giao hưởng Seattle Symphony nằm ở khu trung tâm ...",https://vi.wikipedia.org/wiki/Nh%C3%A0_h%C3%A1t_Benaroya,
Nhà hát Chèo Quân đội – Wikipedia tiếng Việt,"Nhà hát được thành lập trên cơ sở nâng cấp Đoàn Chèo Tổng cục Hậu cần từ năm 2010. Nhà hát Chèo Quân đội có trụ sở tại Phường Xuân Đỉnh, Quận Bắc Từ Liêm, Hà ...",https://vi.wikipedia.org/wiki/Nh%C3%A0_h%C3%A1t_Ch%C3%A8o_Qu%C3%A2n_%C4%91%E1%BB%99i,
"Ngày hội tư vấn tuyển sinh 2023: Gặp các trường đại học, cao đẳng ...","Ban tư vấn của ngày hội do Tuổi Trẻ xây dựng với sự tham gia của đại diện Vụ Giáo dục đại học (Bộ GD-ĐT), Cục Nhà ... hát tặng và giao lưu với học sinh tại ...",https://vnur.vn/ngay-hoi-tu-van-tuyen-sinh-2023-gap-cac-truong-dai-hoc-cao-dang-tai-tp-hcm/,
