Title,Snippet,URL,Topics
Cận cảnh nơi Hà Nội tính xây nhà hát 10.000 tỉ đồng ngay sát hồ Tây,"Nov 29, 2024 ... Theo tìm hiểu, nhà hát dự kiến được xây dựng theo dạng nổi nằm trên mặt nước giữa Đầm Trị, ngay sát hồ Tây. Nhà hát có diện tích khoảng 13.000m² ...",https://tuoitre.vn/can-canh-noi-ha-noi-tinh-xay-nha-hat-10-000-ti-dong-ngay-sat-ho-tay-20241129150111719.htm,
Vì sao hàng ngàn người tập trung trước Nhà hát lớn Hà Nội khiến ...,"Nov 24, 2024 ... Theo tìm hiểu của Tuổi Trẻ Online, sự kiện diễn ra trước khu vực Nhà hát lớn tối 24-11 sẽ có sự góp mặt của các ngôi sao đình đám hàng đầu ...",https://tuoitre.vn/vi-sao-hang-ngan-nguoi-tap-trung-truoc-nha-hat-lon-ha-noi-khien-duong-tac-tu-sang-toi-chieu-20241124164155963.htm,
Những con ma nhà hát của Lê Hoàng: Khi sân khấu không còn là ...,"Aug 23, 2024 ... Xuyên suốt mạch kịch, bốn nhân vật do Lê Khánh, Trương Hạ, Hữu Châu, Thành Lộc thủ vai đại diện cho bốn nhóm tính cách thường gặp ở một con ...",https://tuoitre.vn/nhung-con-ma-nha-hat-cua-le-hoang-khi-san-khau-khong-con-la-thanh-duong-20240815144905941.htm,
Nhà hát Hồ Gươm hài hòa với kiến trúc và cảnh quan tự nhiên ...,"Jul 9, 2023 ... Hà Nội dự kiến xây nhà hát 1.600 chỗ ngồi khu Đầm Trị, ngay sát hồ Tây. Các kiến trúc sư chọn cách gây ấn tượng cho công trình với mọi người ...",https://tuoitre.vn/nha-hat-ho-guom-hai-hoa-voi-kien-truc-va-canh-quan-tu-nhien-202307091427292.htm,
"Cháy quán bar ở tầng hầm Nhà hát Trưng Vương, Đà Nẵng - Tuổi ...","Oct 11, 2024 ... Vụ cháy quán bar ở tầng hầm đã khiến khói mù mịt bao phủ xung quanh khu vực Nhà hát Trưng Vương ở trung tâm thành phố Đà Nẵng. Cháy quán bar ở ...",https://tuoitre.vn/chay-quan-bar-o-tang-ham-nha-hat-trung-vuong-da-nang-20241011104046194.htm,
Tự Long làm giám đốc Nhà hát Chèo Quân đội; BTS hoãn lên sóng ...,"Dec 31, 2024 ... People đưa tin Angelina Jolie và Brad Pitt đã đạt được thỏa thuận ly hôn sau 8 năm, kể từ khi ngôi sao Maria đệ đơn chấm dứt cuộc hôn nhân kéo ...",https://tuoitre.vn/tu-long-lam-giam-doc-nha-hat-cheo-quan-doi-bts-hoan-len-song-vi-tham-kich-chay-may-bay-20241231102159803.htm,
Vì sao Nhà hát Hồ Gươm hiện đại lại có chiếc cổng tam quan cổ kính?,"Jul 11, 2023 ... Văn phòng kiến trúc sư Hồ Thiệu Trị và cộng sự đã thiết kế nhà hát gây chú ý trong mấy ngày qua. Nhưng ý tưởng trùng tu chiếc cổng tam quan cổ ...",https://tuoitre.vn/vi-sao-nha-hat-ho-guom-hien-dai-lai-co-chiec-cong-tam-quan-co-kinh-20230711173950332.htm,
Nhà hát Hồ Gươm 'không phải ai muốn vào diễn cũng được' - Tuổi ...,"Mar 12, 2024 ... Musical Seasons 2024 - 2025 sẽ khép lại bằng vở opera kinh điển Carmen của nhà soạn nhạc người Pháp Georges Bizet, do các nghệ sĩ của Nhà hát ...",https://tuoitre.vn/nha-hat-ho-guom-khong-phai-ai-muon-vao-dien-cung-duoc-20240312194728081.htm,
"Dự án nhà hát lại lỗi hẹn, Bình Thuận yêu cầu làm rõ trách nhiệm ...","Jul 18, 2024 ... Thời gian thực hiện dự án là 4 năm, cuối giai đoạn 2016-2020 và chuyển tiếp sang giai đoạn 2021-2025. Dự án được triển khai thi công từ năm 2019 ...",https://tuoitre.vn/du-an-nha-hat-lai-loi-hen-binh-thuan-yeu-cau-lam-ro-trach-nhiem-20240718164359635.htm,
"Ghé ga metro Nhà hát thành phố, đừng bỏ lỡ những địa điểm này","Dec 17, 2024 ... Cách lối số 1 ga metro Nhà hát Thành phố hơn 100m là Tượng đài Chủ tịch Hồ Chí Minh và tòa nhà trụ sở UBND TP.HCM. Nơi này được kết nối với phố ...",https://muctim.tuoitre.vn/ghe-ga-metro-nha-hat-thanh-pho-dung-bo-lo-nhung-dia-diem-nay-101241217201803874.htm,
"Cận cảnh Nhà hát hồ Gươm 5.000 m2 tại vị trí đất ""kim cương""","Jul 9, 2023 ... Với quy mô 5.000 m2, Nhà hát hồ Gươm nằm tại giao điểm những phố lớn trung tâm TP Hà Nội. Nhà hát có 6 tầng nổi, 3 tầng hầm, gồm khán phòng ...",https://nld.com.vn/thoi-su/can-canh-nha-hat-ho-guom-5000-m2-tai-vi-tri-dat-kim-cuong-cua-ha-noi-20230709134416491.htm,
Hai diễn viên bị đánh ghen khiến Nhà hát Nghệ thuật đương đại ...,"Nov 5, 2023 ... Vụ diễn viên của Nhà hát Nghệ thuật đương đại Việt Nam bị đánh ghen đã gây nhiều ảnh hưởng đến nhà hát. Trang Facebook của nhà hát bị khóa ...",https://nld.com.vn/thoi-su/hai-dien-vien-bi-danh-ghen-khien-nha-hat-nghe-thuat-duong-dai-viet-nam-bi-anh-huong-20231105202209793.htm,
Chơi vơi nhà hát Tây Đô,"Aug 31, 2016 ... Nhà hát này nằm tại Quảng trường Hùng Vương thuộc địa bàn phường 1, TP Bạc Liêu, có tên chính thức là Nhà hát Cao Văn Lầu và Trung tâm Triển lãm ...",https://nld.com.vn/van-hoa-van-nghe/nha-hat-vang-nguoi-xem-choi-voi-nha-hat-tay-do-20160831214101809.htm,
Nhà hát Lớn Hà Nội kỷ niệm 110 năm tuổi,"Dec 12, 2021 ... Dương Thụ trải lòng ở Nhà hát Lớn. (NLĐO)- Sân khấu của Những câu chuyện kể của tôi tối 9-11 tại Nhà hát Lớn Hà Nội không có những màn múa minh ...",https://nld.com.vn/van-nghe/nha-hat-lon-ha-noi-ky-niem-110-nam-tuoi-20211212094920104.htm,
Hà Nội muốn xây nhà hát Opera bên hồ Tây,"Jul 13, 2022 ... Nhà hát Opera được xây dựng nổi trên hồ Đầm Trị (quận Tây Hồ, Hà Nội) được kỳ vọng trở thành biểu tượng văn hóa mới của Thủ đô.",https://nld.com.vn/thoi-su/ha-noi-muon-xay-nha-hat-dien-tich-13000-m2-3500-cho-ben-ho-tay-20220713081230421.htm,
Những con ma nhà hát: Sân khấu cũng là đời,"Mar 26, 2007 ... Trong vai trò người dẫn truyện, NSƯT Thành Lộc cứ thế kéo khán giả đi đến tận cùng, từ đầu đến cuối vở. Không lạ khi vở diễn tập hợp một ê-kíp ...",https://nld.com.vn/san-khau/nhung-con-ma-nha-hat-san-khau-cung-la-doi-184137.htm,
"Vụ cháy gây khói đen dày đặc bủa vây Nhà hát Trưng Vương, Đà ...","Oct 11, 2024 ... (NLĐO) - Vụ cháy xuất phát từ khu vực tầng hầm Nhà hát Trưng Vương khiến khói đen bốc lên dữ dội.",https://nld.com.vn/vu-chay-gay-khoi-den-day-dac-bua-vay-nha-hat-trung-vuong-da-nang-196241011114119983.htm,
"Nhà hát kịch trên phố ""kim cương"" Tràng Tiền ngay trung tâm Thủ ...","Sep 9, 2022 ... Rác thải bị bỏ lại trước khu vực Nhà hát kịch Hà Nội (số 42 phố Tràng Tiền, phường Tràng Tiền, quận Hoàn Kiếm, TP Hà Nội) gây mất mỹ quan đô ...",https://nld.com.vn/thoi-su/nha-hat-kich-tren-pho-kim-cuong-trang-tien-thanh-bai-rac-ma-khong-ai-don-202209091209119.htm,
"""Bóng ma trong nhà hát"": Vở nhạc kịch thành công nhất mọi thời đại","Mar 16, 2004 ... Bằng chất giọng thuần khiết, trong vắt và những gì học được từ Phantom, Christie được nhận vai chính và vai diễn của cô đã làm rung động cả ...",https://nld.com.vn/van-hoa-van-nghe/bong-ma-trong-nha-hat-vo-nhac-kich-thanh-cong-nhat-moi-thoi-dai-54283.htm,
"""Thánh đường"" nghệ thuật ở Nhà hát Lớn: Vẫn là giấc mơ","May 14, 2017 ... Gần 20 chương trình thuộc nhiều loại hình sân khấu như kịch nói, tuồng, chèo, cải lương, ca múa nhạc… được lựa chọn biểu diễn tại Nhà hát Lớn ...",https://nld.com.vn/van-hoa-van-nghe/thanh-duong-nghe-thuat-o-nha-hat-lon-van-la-giac-mo-20170514212221787.htm,
Cận cảnh Nhà hát Hồ Gươm vừa lọt top 10 nhà hát opera tuyệt vời ...,"Dec 11, 2023 ... Theo kết quả bình chọn từ các chuyên gia du lịch của tổ chức Giải thưởng Du lịch Thế giới World Travel Awads, Top 10 nhà hát opera tuyệt vời ...",https://tienphong.vn/can-canh-nha-hat-ho-guom-vua-lot-top-10-nha-hat-opera-tuyet-voi-nhat-the-gioi-post1594690.tpo,
"Nhiều nhà hát ở Hà Nội đìu hiu, hoạt động cầm chừng","Jun 2, 2023 ... Gần 20 nhà hát quy mô từ 200- 1.000 chỗ ngồi được phân bổ khắp thành phố Hà Nội. Tuy nhiên không phải tất cả các rạp có thể sáng đèn đều đặn ...",https://tienphong.vn/nhieu-nha-hat-o-ha-noi-diu-hiu-hoat-dong-cam-chung-post1539418.tpo,
Diện mạo Nhà hát Hồ Gươm với sức chứa 900 ghế,"Jul 13, 2023 ... TPO - Được đánh giá là Nhà hát đầu tư những trang thiết bị hiện đại nhất cả nước, Nhà hát Hồ Gươm do Bộ Công an và UBND thành phố Hà Nội xây ...",https://tienphong.vn/dien-mao-nha-hat-ho-guom-voi-suc-chua-900-ghe-post1550940.tpo,
"Khám phá nhà hát Sông Hương 1.000 chỗ độc đáo, sang trọng và ...","Jul 25, 2020 ... TPO - Nhà hát Sông Hương (TP Huế) có quy mô 1.000 chỗ ngồi, với giá trị đầu tư gần 200 tỷ đồng vừa hoàn thành xây dựng, và là nơi tổ chức ...",https://tienphong.vn/nha-hat-1000-cho-doc-dao-sang-trong-va-hoanh-trang-bac-nhat-xu-hue-post1259488.tpo,
Ai thay thế vị trí giám đốc của NSND Xuân Bắc ở Nhà hát Kịch Việt ...,"Oct 31, 2024 ... Lãnh đạo của Nhà hát Kịch Việt Nam sẽ do lãnh đạo Bộ VHTTDL quyết định. Để biết được người kế nhiệm NSND Xuân Bắc vẫn phải đợi thông báo chính ...",https://tienphong.vn/ai-thay-the-vi-tri-giam-doc-cua-nsnd-xuan-bac-o-nha-hat-kich-viet-nam-post1687137.tpo,
"Cháy quán bar giữa trung tâm Đà Nẵng, nhà hát Trưng Vương chìm ...","Oct 11, 2024 ... Theo thông tin ban đầu, vào khoảng 9h sáng 11/10, tại quán Bar Lamboghini Club (số 118A, Nguyễn Chí Thanh, TP Đà Nẵng) bất ngờ bốc cháy.",https://tienphong.vn/chay-quan-bar-giua-trung-tam-da-nang-nha-hat-trung-vuong-chim-trong-bien-khoi-post1681400.tpo,
Thưởng thức hệ thống âm thanh hiện đại bậc nhất thế giới của Nhà ...,"Aug 16, 2023 ... Hệ thống âm thanh của nhà hát được cung cấp bởi Meyer Sound Laboratories (Mỹ) – nhà cung cấp thiết bị âm thanh cho các sân khấu Broadway và nhà ...",https://tienphong.vn/thuong-thuc-he-thong-am-thanh-hien-dai-bac-nhat-the-gioi-cua-nha-hat-ho-guom-post1560850.tpo,
Bốn nghệ sĩ nhận danh hiệu NSND của Nhà hát Kịch Việt Nam,"Mar 7, 2024 ... TPO - Tại Lễ trao danh hiệu nghệ sĩ nhân dân (NSND), nghệ sĩ ưu tú (NSƯT) lần thứ 10 diễn ra tại Nhà hát Lớn Hà Nội ngày 6/3, 8 nghệ sĩ, ...",https://tienphong.vn/bon-nghe-si-nhan-danh-hieu-nsnd-cua-nha-hat-kich-viet-nam-post1618207.tpo,
Người tạm thay NSND Xuân Bắc điều hành Nhà hát Kịch Việt Nam,"Nov 8, 2024 ... TPO - NSƯT Kiều Minh Hiếu - Phó Giám đốc Nhà hát Kịch Việt Nam sẽ điều hành hoạt động và đứng tên chủ tài khoản của nhà hát trong thời gian ...",https://tienphong.vn/nguoi-tam-thay-nsnd-xuan-bac-dieu-hanh-nha-hat-kich-viet-nam-post1689661.tpo,
Ba nghệ sĩ ở Nhà hát Kịch Việt Nam được phong Nghệ sĩ Nhân dân,"Dec 7, 2023 ... TPO - Nhà hát Kịch Việt Nam có ba nghệ sĩ được phong tặng danh hiệu Nghệ sĩ Nhân dân (NSND) theo quyết định 1431/QĐ-CTN do Chủ tịch nước Võ ...",https://tienphong.vn/ba-nghe-si-o-nha-hat-kich-viet-nam-duoc-phong-nghe-si-nhan-dan-post1593129.tpo,
NSND Tự Long được bổ nhiệm làm Giám đốc Nhà hát Chèo Quân ...,"Dec 30, 2024 ... (Dân trí) - NSND Vũ Tự Long được bổ nhiệm làm Giám đốc Nhà hát Chèo Quân đội, thay NSND Quốc Trượng nghỉ hưu theo chế độ.",https://dantri.com.vn/giai-tri/nsnd-tu-long-duoc-bo-nhiem-lam-giam-doc-nha-hat-cheo-quan-doi-20241230210607336.htm,
Nhà hát Hồ Gươm lọt top 10 nhà hát opera tốt nhất thế giới | Báo ...,"Dec 11, 2023 ... Một trong những điểm nhấn của công trình là kiến trúc châu Âu cổ kính có 52 cột đá với mỗi cột cao 18m, được nhập khẩu từ Tây Ban Nha. Ngoài ra, ...",https://dantri.com.vn/du-lich/nha-hat-ho-guom-lot-top-10-nha-hat-opera-tot-nhat-the-gioi-20231210230656443.htm,
"Cận cảnh nhà hát Hồ Gươm, có sân khấu hiện đại bậc nhất Đông ...","Jul 9, 2023 ... (Dân trí) - Nhà hát Hồ Gươm do Bộ Công an và UBND thành phố Hà Nội đầu tư xây dựng tại phố Hàng Bài (Hà Nội) có 2 khán phòng lớn và sân khấu ...",https://dantri.com.vn/van-hoa/can-canh-nha-hat-ho-guom-co-san-khau-hien-dai-bac-nhat-dong-nam-a-20230708163344562.htm,
Nhà hát Opera bên Hồ Tây sẽ được xây dựng như thế nào? | Báo ...,"Jul 16, 2022 ... Được biết, ""cha đẻ"" của ý tưởng độc đáo này là kiến trúc sư người Italia - ông Renzo Piano, một kiến trúc sư huyền thoại trong làng kiến trúc ...",https://dantri.com.vn/xa-hoi/nha-hat-opera-ben-ho-tay-se-duoc-xay-dung-nhu-the-nao-20220715154714580.htm,
Những bí mật có thể bạn chưa biết về nhà hát cổ ở Hy Lạp | Báo ...,"Nov 13, 2021 ... Nhà hát cổ Epidaurus ở thành phố Epidaurus, Hy Lạp là một kiệt tác kiến trúc được thiết kế bởi kiến trúc sư đến từ Argos, Hy Lạp. Đây được coi ...",https://dantri.com.vn/du-lich/nhung-bi-mat-co-the-ban-chua-biet-ve-nha-hat-co-o-hy-lap-20211112110329318.htm,
Thành lập Nhà hát Hồ Gươm | Báo Dân trí,"Jun 10, 2023 ... (Dân trí) - Nhà hát Hồ Gươm trực thuộc Cục Công tác đảng và công tác chính trị (Bộ Công an), do Thiếu tướng, NSND Nguyễn Công Bẩy làm Giám ...",https://dantri.com.vn/xa-hoi/thanh-lap-nha-hat-ho-guom-20230610130819141.htm,
Chân dung nhóm khủng bố nhận tấn công nhà hát Nga | Báo Dân trí,"Mar 23, 2024 ... (Dân trí) - ISIS-K, nhóm nhận trách nhiệm vụ khủng bố đẫm máu tại Nga tối 22/3, đã thực hiện nhiều vụ tấn công gây thương vong, trong đó có vụ ...",https://dantri.com.vn/the-gioi/chan-dung-nhom-khung-bo-nhan-tan-cong-nha-hat-nga-20240323161511926.htm,
Kiến nghị Hà Nội sớm triển khai nhà hát Opera ở Quảng An | Báo ...,"Jan 11, 2024 ... (Dân trí) - Quận Tây Hồ kiến nghị Hà Nội sớm triển khai thực hiện 3 dự án trọng điểm trên địa bàn quận, trong đó có Nhà hát Opera tại khu vực ...",https://dantri.com.vn/xa-hoi/kien-nghi-ha-noi-som-trien-khai-nha-hat-opera-o-quang-an-20240111200356972.htm,
Hà Nội phê duyệt quy hoạch nhà hát Opera sát hồ Tây | Báo Dân trí,"Nov 28, 2024 ... (Dân trí) - Điểm nhấn của khu vực trục không gian trung tâm bán đảo Quảng An tỷ lệ 1/500 vừa được phê duyệt là sẽ xây dựng một nhà hát có ...",https://dantri.com.vn/xa-hoi/ha-noi-phe-duyet-quy-hoach-nha-hat-opera-sat-ho-tay-20241128121704179.htm,
"NSND Trung Hiếu, Công Lý mừng khi Nhà hát Kịch Hà Nội có Phó ...","Aug 4, 2023 ... (Dân trí) - Ngày 3/8, Sở Văn hóa và Thể thao Hà Nội trao quyết định bổ nhiệm NSƯT Dương Đức Quang làm Phó giám đốc Nhà hát Kịch Hà Nội.",https://dantri.com.vn/van-hoa/nsnd-trung-hieu-cong-ly-mung-khi-nha-hat-kich-ha-noi-co-pho-giam-doc-moi-20230804140742426.htm,
"Ngoài là nơi biểu diễn nghệ thuật, nhà hát còn chức năng gì? - Âm ...","Oct 13, 2018 ... Ngoài các thính phòng phục vụ mục đích trình diễn nghệ thuật, nhà hát còn được sử dụng với những mục đích khác như nghiên cứu và phát triển âm ...",https://lifestyle.zingnews.vn/ngoai-la-noi-bieu-dien-nghe-thuat-nha-hat-con-chuc-nang-gi-post883960.html,
Nhà hát Con Sò lộng lẫy trong đêm giao thừa ở Sydney - Thế giới,"Dec 31, 2016 ... Nhà hát opera Sydney nổi tiếng là địa điểm bắn pháo hoa truyền thống ở Australia, thu hút khoảng 1,5 triệu người đổ về xem các màn trình ...",https://zingnews.vn/nha-hat-con-so-long-lay-trong-dem-giao-thua-o-sydney-post710242.html,
Những nhà hát biểu tượng trên thế giới có tầm vóc ra sao? - Âm nhạc,"Oct 10, 2018 ... Nhà hát giao hưởng, opera không chỉ là những công trình nổi tiếng, có tầm vóc mà còn được xem là biểu tượng văn hóa, nghệ thuật và du lịch ...",https://zingnews.vn/nhung-nha-hat-bieu-tuong-tren-the-gioi-co-tam-voc-ra-sao-post883023.html,
Nhà hát 3 nón lá 222 tỷ xây chưa xong đã được xác lập kỷ lục - Xã hội,"Oct 14, 2014 ... Nhà hát 3 nón lá 222 tỷ xây chưa xong đã được xác lập kỷ lục. Nhà hát Cao Văn Lầu và Trung tâm Triển lãm văn hóa nghệ thuật tỉnh Bạc Liêu chỉ ...",https://zingnews.vn/nha-hat-3-non-la-222-ty-xay-chua-xong-da-duoc-xac-lap-ky-luc-post467677.html,
Những nhà hát opera nổi tiếng thế giới - Địa điểm du lịch,"Oct 11, 2018 ... Royal Opera House (Anh): Vị trí nhà hát này trên con phố lớn Bow Street ở khu Covent Garden, London vốn từng tồn tại những nhà hát khác nhau từ ...",https://lifestyle.zingnews.vn/nhung-nha-hat-opera-noi-tieng-the-gioi-post876832.html,
Bộ Văn hóa nói về việc xây nhà hát opera ở hồ Tây - Xã hội,"Jul 28, 2022 ... Theo đồ án này, tại khu vực đầm Trị (phường Quảng An, Tây Hồ) sẽ được xây dựng một nhà hát opera với diện tích rộng khoảng 13.000 m2. Quy mô chỗ ...",https://zingnews.vn/bo-van-hoa-noi-ve-viec-xay-nha-hat-opera-o-ho-tay-post1340008.html,
Giám đốc Nhà hát Kịch Việt Nam Anh Tú qua đời ở tuổi 56 - Đời ...,"Dec 20, 2018 ... Sau nhiều tháng điều trị bệnh, NSND Anh Tú đã qua đời lúc 12h15 phút, ngày 20/12 tại bệnh viện ở Hà Nội, hưởng dương 56 tuổi.",https://zingnews.vn/giam-doc-nha-hat-kich-viet-nam-anh-tu-qua-doi-o-tuoi-56-post902034.html,
Bi kịch đằng sau chiếc ghế giám đốc Nhà hát Kịch Việt Nam - Giải trí,"Sep 20, 2017 ... Ở thời điểm sân khấu bế tắc nhất, NSND Lê Hùng giữ chức giám đốc của cả 2 nhà hát: Nhà hát Tuổi trẻ và Nhà hát Kịch Việt Nam. Khi đó, NSND Lê ...",https://zingnews.vn/bi-kich-dang-sau-chiec-ghe-giam-doc-nha-hat-kich-viet-nam-post780774.html,
Chí Trung: Nhà hát Tuổi trẻ sắp có cơ sở mới với vốn đầu tư 400 tỷ ...,"Feb 28, 2018 ... Nhà hát được xây dựng trên diện tích đất 6.724 m2, với 5 tầng nổi, 3 tầng chìm. Nhà hát có 2 sân khấu với quy mô khác nhau, sân khấu lớn 920 chỗ ...",https://zingnews.vn/chi-trung-nha-hat-tuoi-tre-sap-co-co-so-moi-voi-von-dau-tu-400-ty-post822256.html,
Hà Nội sơn lại Nhà hát Lớn trở về màu cũ,"Jul 24, 2015 ... Nhà hát Lớn Hà Nội được sơn mới sặc sỡ ... Đầu tháng 7, Nhà hát Lớn Hà Nội - công trình Pháp cổ hơn 100 tuổi được sơn mới màu vàng đậm pha trắng, ...",https://zingnews.vn/ha-noi-son-lai-nha-hat-lon-tro-ve-mau-cu-post562301.html,
Hà Nội phê duyệt quy hoạch nhà hát Opera tầm cỡ quốc tế tại ...,"Dec 2, 2024 ... Đặc biệt, dự án nhà hát được thiết kế bởi kiến trúc sư nổi tiếng người Ý Renzo Piano - “cây đại thụ” của ngành kiến trúc hiện đại với những tác ...",https://vietnamnet.vn/ha-noi-phe-duyet-quy-hoach-nha-hat-opera-tam-co-quoc-te-tai-quang-an-tay-ho-2347800.html,
Nhà hát Hồ Gươm đứng đầu top 'nhà hát opera tuyệt vời nhất thế giới',"Dec 8, 2023 ... Nhà hát Hồ Gươm đứng đầu top 'nhà hát opera tuyệt vời nhất thế giới' · Mới đây, trang web 10best của tổ chức 'Giải thưởng Du lịch Thế giới World ...",https://vietnamnet.vn/nha-hat-ho-guom-dung-dau-top-nha-hat-opera-tuyet-voi-nhat-the-gioi-2224677.html,
Toàn cảnh vị trí sát Hồ Tây sẽ xuất hiện nhà hát 10.000 tỷ đồng,"Nov 30, 2024 ... Phía Đông Nam giáp các khu đất ven trục không gian Đặng Thai Mai, khu biệt thự Tây Hồ. nha hat ho tay 5 124917.jpg. Vị trí hồ Đầm Trị, nơi được ...",https://vietnamnet.vn/toan-canh-vi-tri-sat-ho-tay-se-xuat-hien-nha-hat-10-000-ty-dong-2347087.html,
Giám đốc Nhà hát Ca múa nhạc Quân đội được phong tặng NSND,"Dec 8, 2023 ... Đại tá, NSƯT Nguyễn Thị Bích Hạnh (nghệ danh Hồng Hạnh) là một trong những nữ ca sĩ xuất sắc của quân đội. Chị là nghệ sĩ nữ đầu tiên giữ cương ...",https://vietnamnet.vn/giam-doc-nha-hat-ca-mua-nhac-quan-doi-duoc-phong-tang-nsnd-2223367.html,
Vườn âm nhạc đặc biệt tại Nhà hát Lớn,"Mar 3, 2024 ... Với mục đích này, Nhà hát Lớn Hà Nội tạo dựng ý tưởng khuôn viên 3.000m2 Vườn âm nhạc, lấy tên là Garden Music. Không gian ngoài trời mang đến ...",https://vietnamnet.vn/vuon-am-nhac-dac-biet-tai-nha-hat-lon-2255383.html,
Bên trong Nhà hát Hồ Gươm hiện đại nhất Việt Nam,"Jul 9, 2023 ... Salmon tổ chức trưng bày 25 bản in từ kiệt tác của các họa sĩ nổi tiếng như Lê Phổ, Mai Trung Thứ, Vũ Cao Đàm…theo hình thức mô phỏng lại không ...",https://vietnamnet.vn/ben-trong-nha-hat-ho-guom-hien-dai-nhat-viet-nam-2163215.html,
"Nhà hát Hồ Gươm: Nếu có tâm, mọi chuyện đều có thể","Aug 18, 2023 ... Đến với Nhà hát Hồ Gươm tối qua, tôi tự nhủ đây đúng là một địa điểm khiến người ta rung động.",https://vietnamnet.vn/nha-hat-ho-guom-neu-co-tam-moi-chuyen-deu-co-the-2178894.html,
"Đại tá, NSND Tự Long được bổ nhiệm làm Giám đốc Nhà hát Chèo ...","Dec 30, 2024 ... Theo Quyết định số 133/QĐX-BQP ngày 10/12/2024 của Bộ trưởng Bộ Quốc phòng về việc Đại tá, NSND Nguyễn Quốc Trượng, Giám đốc Nhà hát Chèo Quân ...",https://vietnamnet.vn/dai-ta-nsnd-tu-long-duoc-bo-nhiem-lam-giam-doc-nha-hat-cheo-quan-doi-2358319.html,
Tài xế drift xe Nissan trước Nhà hát Lớn đối diện hình phạt nào?,"Apr 18, 2023 ... Ô tô drift gây náo loạn trước Nhà hát LớnTại cơ quan công an, bước đầu T. khai nhận đã điều khiển xe ô tô 4 chỗ chạy drift trước khu vực Nhà hát ...",https://vietnamnet.vn/tai-xe-drift-xe-nissan-truoc-nha-hat-lon-doi-dien-hinh-phat-nao-2133907.html,
Nhà hát Hồ Gươm lọt Top 10 nhà hát opera tuyệt vời nhất thế giới,"Dec 8, 2023 ... Nhà hát Hồ Gươm (Hà Nội) là đại diện duy nhất của Việt Nam lọt vào Top 10 nhà hát opera tuyệt vời nhất thế giới. · 'Bậc thầy' vĩ cầm, 2 giọng ca ...",https://vietnamnet.vn/nha-hat-ho-guom-lot-top-10-nha-hat-opera-tuyet-voi-nhat-the-gioi-2224654.html,
Nhà hát Hồ Gươm hiện đại nhất Việt Nam,"Jul 9, 2023 ... Nhà hát Hồ Gươm ở 40-40A Hàng Bài (Hà Nội) là nhà hát đầu tiên tại Việt Nam được cung cấp loại máy móc thiết bị rạp hát đạt tiêu chuẩn quốc ...",https://vov.vn/multimedia/anh/ben-trong-nha-hat-ho-guom-hien-dai-nhat-viet-nam-post1031481.vov,
Nhà hát 3 nón lá công trình kiến trúc văn hóa độc đáo giữa lòng ...,"Apr 15, 2023 ... Tọa lạc cạnh Quảng trường Hùng Vương, Phường 1, thành phố Bạc Liêu, Nhà hát Cao Văn Lầu được xây dựng theo mô hình 3 chiếc nón lá đan xen ...",https://vov.vn/van-hoa/di-san/nha-hat-3-non-la-cong-trinh-kien-truc-van-hoa-doc-dao-giua-long-mien-tay-post1014124.vov,
Cận cảnh Nhà hát dân ca Quan họ hơn 241 tỷ đồng đang gây tranh ...,"May 15, 2023 ... Nhà hát dân ca Quan họ Bắc Ninh được xây dựng từ năm 2016 nằm trên diện tích 19.400m2 và hoàn thành từ năm 2020 do Ban quản lý khu vực phát ...",https://vov.vn/van-hoa/di-san/can-canh-nha-hat-dan-ca-quan-ho-hon-241-ty-dong-dang-gay-tranh-cai-o-bac-ninh-post1020131.vov,
"Nhà hát Kịch Việt Nam: Cuộc chiến phe cánh, nghệ sĩ u uất cuối đời ...","Sep 18, 2017 ... Nhưng việc NSND Lê Hùng cùng lúc đứng đầu hai nhà hát lớn gây nhiều bàn tán, có những ý kiến không đồng tình từ các nghệ sĩ nổi tiếng. Nhiều ...",https://vov.vn/van-hoa-giai-tri/nha-hat-kich-viet-nam-cuoc-chien-phe-canh-nghe-si-u-uat-cuoi-doi-672441.vov,
Nhà hát Hải Phòng và trận đánh không thể lãng quên | VOV.VN,"Dec 17, 2016 ... Ngày 20/12/1946, tại Hang Trầm (huyện Chương Mỹ, Hà Tây), Đài Tiếng nói Việt Nam đã phát đi ""Lời kêu gọi toàn quốc kháng chiến"". Thế nhưng ít ai ...",https://vov.vn/chinh-tri/nha-hat-hai-phong-va-tran-danh-khong-the-lang-quen-578294.vov,
Bức Tường hát Rock trong Nhà hát Hồ Gươm,"Aug 20, 2024 ... VOV.VN - ""Những bức tường"" là phim tài liệu về ban nhạc rock hàng đầu Việt Nam - Bức Tường. Phim có thời lượng dài 116 phút, tái hiện những khó ...",https://vov.vn/van-hoa/am-nhac/ban-nhac-buc-tuong-lan-dau-tien-lam-liveshow-trong-nha-hat-ho-guom-post1115565.vov,
