Title,Snippet,URL,Topics,Categories,Tags
"Đời sống - Báo Tuổi Trẻ - Tin tức mới nhất, tin nhanh, tin nóng 24h","Đời sống - Tin tức mới nhất trên các lĩnh vực chính trị, xã hội, văn hóa, thể thao ở Việt Nam và quốc tế. Tin tức thời sự mỗi ngày sẽ được Tuổi Trẻ Online ...",https://tuoitre.vn/van-hoa/doi-song.htm,"mới nhất, văn hóa, Tuổi Trẻ Online, thể thao ở, thời sự mỗi, Đời sống Tin tức, lĩnh vực chính trị","Xã hội, Thể thao","Tin tức mới, lĩnh vực chính trị, văn hóa, Đời sống, Tin tức, lĩnh vực, chính trị, xã hội, thể thao, Việt Nam"
Đời sống công nhân: Một sự nghèo nàn khác - Tuổi Trẻ Online,"13 thg 12, 2022 ... Thu nhập không đủ để chi cho các nhu cầu tinh thần, thể trạng mệt mỏi do cường độ công việc chân tay ở nhà máy cao là nguyên nhân chủ yếu khiến ...",https://cuoituan.tuoitre.vn/doi-song-cong-nhan-mot-su-ngheo-nan-khac-20221209103337714.htm,"đủ để chi, thg Thu nhập, ở nhà máy cao, chủ yếu khiến, mệt mỏi do, cho các nhu cầu, tinh thần thể trạng, cường độ công việc",Chưa phân loại,"nhu cầu tinh thần, thể trạng mệt mỏi, cường độ công việc, công việc chân tay, nhà máy cao, là nguyên nhân, nguyên nhân chủ yếu, 2022, Thu nhập, nhu cầu"
Người Hà Nội gốc mà chỉ ba đời sống ở Hà Nội thì chưa đủ - Tuổi ...,"16 thg 11, 2024 ... Về định nghĩa người Hà Nội gốc là người có ít nhất ba đời sống ở Hà Nội, ông Cương cho đó là định nghĩa dễ chấp nhận nhất trong cộng đồng chứ ...",https://tuoitre.vn/nguoi-ha-noi-goc-ma-chi-ba-doi-song-o-ha-noi-thi-chua-du-20241116102248146.htm,"gốc là người, ông Cương cho, dễ chấp nhận nhất, ba đời sống ở, cộng đồng chứ, thg Về định nghĩa",Xã hội,"định nghĩa người, là người, là định nghĩa, định nghĩa dễ, 2024, người, Hà Nội, đời sống, Cương, định nghĩa"
Viện kiểm sát: Cần loại trừ bà Trương Mỹ Lan khỏi đời sống xã hội ...,"19 thg 3, 2024 ... Cần loại khỏi đời sống xã hội vĩnh viễn đối với bị cáo Trương Mỹ Lan. Từ ngày 9-2-2018 đến ngày 7-10-2022, Trương Mỹ Lan đã chỉ đạo lập khống ...",https://tuoitre.vn/vien-kiem-sat-can-loai-tru-ba-truong-my-lan-khoi-doi-song-xa-hoi-vinh-vien-20240318134634655.htm,"Trương Mỹ Lan, thg Cần loại, lập khống, khỏi đời sống, xã hội vĩnh viễn, đối với bị cáo",Xã hội,"Cần loại, khỏi đời sống, đời sống xã hội, xã hội vĩnh viễn, Từ ngày 9-2-2018, đến ngày 7-10-2022, lập khống, 2024, loại, đời sống"
"Đời sống - Đời sống tuổi teen, trào lưu, giới trẻ, thể thao, hoạt động ...","Tin tức mới nhất, video clip và hình ảnh về chủ đề Đời sống trên Mực Tím.",https://muctim.tuoitre.vn/doi-song.htm,"Mực Tím, mới nhất video clip, chủ đề Đời sống",Xã hội,"Tin tức mới, chủ đề Đời sống, Tin tức, hình ảnh, Đời sống"
18 năm ngày giỗ Trịnh Công Sơn: Đời sống nhân danh con người ...,"1 thg 4, 2019 ... Nối cuộc tình nối lòng đổ nát. Bàn tay đi nối anh em [...]. Cùng xương khô lên tiếng nói. Đời sống ấm êm nhân danh con người"".",https://tuoitre.vn/18-nam-ngay-gio-trinh-cong-son-doi-song-nhan-danh-con-nguoi-2019040110381044.htm,"cuộc tình nối, thg Nối, Cùng xương khô lên, Bàn tay đi, lòng đổ nát, tiếng nói Đời sống, ấm êm nhân danh",Xã hội,"Nối cuộc, cuộc tình, nối lòng, nối anh em, lên tiếng, Đời sống ấm êm, nhân danh con người, 2019, cuộc, tình"
Kiên Giang: Nông thôn mới giúp nâng cao đời sống người dân ...,"17 thg 12, 2024 ... Đất ít nên làm lúa lúc trúng lúc thất, gia đình anh mãn vụ lúa cũ đổi lúa mới, lợi nhuận không cao, cuộc sống khó khăn. Kể từ khi xã Tân Hiệp A ...",https://tuoitre.vn/kien-giang-nong-thon-moi-giup-nang-cao-doi-song-nguoi-dan-20241217091547921.htm,"mãn vụ lúa, thg Đất ít, cũ đổi, trúng lúc thất, nên làm, cao cuộc sống, Kể từ khi xã, gia đình anh, mới lợi nhuận",Chưa phân loại,"Đất ít, làm lúa, lúa lúc, trúng lúc, mãn vụ, vụ lúa, lúa cũ, đổi lúa, lúa mới, cuộc sống khó khăn"
Bản chất và vai trò của giới tính trong đời sống con người - Tuổi Trẻ ...,"8 thg 4, 2005 ... Giới tính làm cho quan hệ giao tiếp giữa hai người khác giới khác hẳn quan hệ giao tiếp giữa hai người cùng giới. Do những đặc điểm giới tính, ...",https://tuoitre.vn/ban-chat-va-vai-tro-cua-gioi-tinh-trong-doi-song-con-nguoi-73679.htm,"người khác giới, giao tiếp giữa hai, thg Giới tính, hẳn quan hệ, Do những đặc điểm",Chưa phân loại,"làm cho quan hệ, người khác, giới khác, người cùng, đặc điểm giới tính, 2005, Giới tính, quan hệ, người, giới"
Đời sống người lao động cần được quan tâm tương xứng với thành ...,"26 thg 10, 2020 ... Chất lượng đội ngũ công nhân có những dấu hiệu hụt hẫng, bất cập. Tỉ lệ lao động qua đào tạo chỉ chiếm 22% lực lượng lao động.Tác phong, kỷ luật ...",https://tuoitre.vn/doi-song-nguoi-lao-dong-can-duoc-quan-tam-tuong-xung-voi-thanh-qua-phat-trien-2020102616244705.htm,"chỉ chiếm, thg Chất lượng, lao động qua, đội ngũ công nhân, dấu hiệu hụt hẫng, bất cập Tỉ lệ, Tác phong kỷ luật",Chưa phân loại,"26 thg, Chất lượng đội ngũ, đội ngũ công nhân, dấu hiệu hụt hẫng, % lực lượng, lực lượng lao động, 2020, Chất lượng, đội ngũ, công nhân"
​Khoa học vui kết nối đời sống - Tuổi Trẻ Online,"2 thg 4, 2017 ... Các bạn cùng tranh tài ở ba nội dung: thi kiến thức khoa học thường thức gắn liền với đời sống hằng ngày, thiết kế tranh ghép nổi bằng các chất ...",https://tuoitre.vn/khoa-hoc-vui-ket-noi-doi-song-1290980.htm,"bạn cùng tranh, gắn liền, tài ở ba, ghép nổi bằng, nội dung thi, kiến thức khoa học, hằng ngày thiết kế",Xã hội,"bạn cùng, tranh tài, thi kiến thức, kiến thức khoa học, khoa học thường thức, thiết kế tranh, 2017, nội dung, kiến thức, khoa học"
